"White_Charter","Tangkuban_Perahu","Dusun_Bambu","Saung_Angklung","Ciater"
"If you come to Bandung, Indonesia. Don't forget to come this place. This place so famous with the best view. This location in Ciwidey, not very far from Bandung City. You can rent motocycle for 1 day or use public transportation. From Bandung, you should go to Terminal Leuwi…","We went to visit tangkubang perahu in mid december and the weather was pleasant at around 25 degrees.we hired a driver (at around rm100 plus per day)and it was a pleasant visit. Eventhough the entrance fee for foreigner is pricey at 200rp (20rp for locals), it was worth the…","To the park could be overly crowded, not just inside the park, food court and even access to the park about 700 meter can take 30 minute just to reach the park gate.","I went there with my husband and we have really nice time there, also we tried to play on angklung :)","I went there with my husband and we have really nice time there, also we tried to play on angklung :)"
"To reach the crater around 20 minutes by car from the main gate. Through the woods, the roads not so good must drive slowly and safely because is going up. The weather in the crater so cold. Good parking space, clean and not so much people selling anything. The entrance fee for…","To know what the inside of the mountain is like and enjoy the beauty of nature with the whole of the five senses. ","Many spot for any instagram freak. There are man-made of small lake and you can hire a boat there. The food is so-so. It was up hill located, so you may feel chill there.","So fun! Gotta try if you're a n Bandung.   Especially good because I was expecting a tourist trap, and this is so not like that :)","So fun! Gotta try if you're a n Bandung.   Especially good because I was expecting a tourist trap, and this is so not like that :)"
"Went to the location early so the place was still not too crowded. Nice place to take pictures. No access to walk to the summit. As the crater still active, could not stay too long. ","The ticket is ridiculously expensive for foreigner. More parking fee besides the one on the gate. If you want to go to Domas Crater you must be guided. And it expensive too. Why need a guide when there's only one way going there?","I am not recommend this place for eat because there is no special taste food in this place. But if you want to make a photograph session this place has some place to make a nice one.","I’m all excited when being informed that we’ll be watching Saung Angklung Udjo. But it’s a bit further up from the city. And with the heavy traffic everywhere, you have to estimate your time correctly or you might end up missing the timely show.  The show I attended started…","I’m all excited when being informed that we’ll be watching Saung Angklung Udjo. But it’s a bit further up from the city. And with the heavy traffic everywhere, you have to estimate your time correctly or you might end up missing the timely show.  The show I attended started…"
"Good view, fresh air. I suggest you take your car by paying idr 150k .If you too lazy to drive, then just pay for angkot to take you to the crater. It cheaper too. But, you ll have to wait for a loooong time in angkot to go to parking lot. They already built the bridge now. Pay…","quite a waste of time here. spent 11 hours in the transport just to get there and back. 1 whole day wasted. too expensive entrance fees.  (300k IDR) too many locals hard-selling their stuff my aunt bought 4 packs of strawberries. ALL infused with sugar syrup!  the view is just…","I was going yesterday, with my family, know this place by googling 'most fav place at Bandung' and this place ia one of them,so i decided to bring my family came here, when we arrived,is rain,is nice that they lend us some umbrella while we waiting a 'Wara wiri car' who bring us…","Bangga bisa ikut melestarikan Angklung dan bertemu dengan Anak alm. mang Udjo Must come and will enjoy it so much","Bangga bisa ikut melestarikan Angklung dan bertemu dengan Anak alm. mang Udjo Must come and will enjoy it so much"
"Must see in bandung! Gorgeous white crater. Recommended to bring/wear a mask as the sulphur, though odourless, irritates your throat and eyes. From the entrance, it’s about a 7km drive up to the white crater. You can choose to go up via your own private vehicle (IDR 150k per…","Only had two hours to visit as it was crowded and jammed with cars, busses. The view was stunning. We spend more time accessing and leaving the site. ","The place is awesome  Beautiful view  to snap  around  Convenient coz there's a shuttle bus to bring you around the park  Good foods too  High recommendation to all <U+0001F44D>","Had a great time in Saung mang Udjo. I think Saung mang Udjo made our trip more pleasant. They are very attractive, funny and not offer boring show. I think saung mang udjo is must to do when you are in Bandung. Will be back here on next visit.","Had a great time in Saung mang Udjo. I think Saung mang Udjo made our trip more pleasant. They are very attractive, funny and not offer boring show. I think saung mang udjo is must to do when you are in Bandung. Will be back here on next visit."
"Volcanic lake situated at 2400m asl. It's about 2 hours drive from Bandung City and the weather is pretty cool. The only thing you can do over the lake is just taking photos and sightseeing. On the way down from the lake, you can have some short visits to the strawberry farm,…","They provide good managements for groups, family, especially in access from the parking lot to the crater. Just like most of the tourism places in Indonesia, it needs a proper rules for the sellers there","Great place for family holiday,  u can take the children.  Have a nice view and restaurant.  Spot to have a nice photos","I got a discount from the ticket since we worked very well for a community nearby. They offered us this majestic concert. Never had such an experience. Due to my musical experience, I am familiar with the sounds they produce. They are ""configured"" to use the C-major. This…","I got a discount from the ticket since we worked very well for a community nearby. They offered us this majestic concert. Never had such an experience. Due to my musical experience, I am familiar with the sounds they produce. They are ""configured"" to use the C-major. This…"
"We decided to come here to experience the view of the volcanic crater. The journey from Bandung took about 2 and a half hours. There view along the journey is very nice as we will pass through the paddy fields, the scenic green tea plantations and nice small cities. We even…","Entry fee varies (depending on whether you're local or not). Heard it was 300K IDR per person but when we visited we paid 200K IDR (??) Be prepared to brave the touts, if you don't want to purchase anything, be polite but firm. Some food options like banana fritters and fried…","Nice place to hangout with family. Good view, food and facilities. Have food court with many choices and restaurants with nice view.","we start at 10 am for the show... we walk in and gamelan sounds calmly..  made us relax.. the the muppet show we called wayang golek.. we can call ""Cepot""... at first i was thought that we will asleep..  but the fact the story very interesting and quit funny... then heleran…","we start at 10 am for the show... we walk in and gamelan sounds calmly..  made us relax.. the the muppet show we called wayang golek.. we can call ""Cepot""... at first i was thought that we will asleep..  but the fact the story very interesting and quit funny... then heleran…"
"Set off for Kawah Putih (white crater) slightly earlier at 7.30 am on a Friday, even though my driver suggested 8am. Our driver used a new expressway and arrived there in less than 2 hours. Managed to beat the crowd, hence better photo opportunities. The crowd started coming in…","Amazing view of the crater (Kawah Ratu). The entrance was expensive for foreigners which is 200,000 (weekdays) and 300,000 (weekend). Last I visited this place (around 2011) I was chased by a big group of people selling their souvenirs. Now it is more organized as each visitors…","Dusun Bambu offers you a panoramic view of flower garden, lake with cottage that you can rent, and a lot of family activities. Its perfect for your family vacation or couple getaway, and dont forget to bring your camera here. ","We had a great time and experience at this place with lots of cultural activities, especially the beautiful instruments and music provided using bamboo by the students of Udjo. The announcer was awesome and kept the audience entertained and well informed. Being a photographer, I…","We had a great time and experience at this place with lots of cultural activities, especially the beautiful instruments and music provided using bamboo by the students of Udjo. The announcer was awesome and kept the audience entertained and well informed. Being a photographer, I…"
"The only downside in going to this place is the travel which took 3 hours or so. If you're not used to bumpy rides, then better prepare yourself. Even though the ride was hectic, I still believe it's a sight worth seeing. Too bad when we went there it was drizzling so we…","Been here for several times but I never get bored to visit this place. This is such a wonderful place for me to enjoy God creation! Well this place located in Lembang Bandung West Java. You have to bring your  jacket with you when you want visit this place. A very recommended…","Best place in lembang bandung for get away bring family especially children ,exiting,safe and clean,price for food quite reasonable","The show was a few hours and included short versions of many traditional dance & music performances. This was fun, but what made it less good for us, was the fact that it is quite long & there are many many many tourists (all the tour buses visit, and there is only one…","The show was a few hours and included short versions of many traditional dance & music performances. This was fun, but what made it less good for us, was the fact that it is quite long & there are many many many tourists (all the tour buses visit, and there is only one…"
"I didn't really feel this place. Yes, it does look pretty but I don't think that it is worth the trip from Bandung. It's just a small lake with white water. If you go bring a jacket as it actually gets quite cold. There were people selling masks for the smell but it really…","It's a lovely area, but as many have pointed out,  expensive  (by Indonesian standards)  for foreigners.  We has a private hire car that dropped us at the top,  ratu crater,  and it was very windy there.  We walked down to Domas crater with a guide (Rp 300,000) and he explained…","If you plan for Glam Camp during December holiday please booked at least 6 month before. We booked 4 Tents for family gathering. Each tent have basic facilities, bbq pit & camp fire. Each tent can fit 4-6 people. have private door, meaning each tent surounded with high fence &…","A great place to visit for angklung cultural performance. Casual, unassuming and fun experience - a must when visiting Bandung!","A great place to visit for angklung cultural performance. Casual, unassuming and fun experience - a must when visiting Bandung!"
"The place is small and crowded. It is also overrated as the view is nothing much compared to tangkuban perahu. Entrance fee is quite cheap at 50,000. Additional 15,000 to go up to Kawah Putih for their local transportation. If you want to use your own private transport (way way…","Today we went to Tangkuban Perahu taking some Indonesian Friends from Tasik . To enter the area, we need to pay the entry tickets. For the local the tickets cost $2 and for the foreigners cost $20. Even it's against my principle to pay 10 times more than the locals, we had no…","Went here with family during our trip to Bandung. Beautiful scenery. They have small rooms for dining that looks like a tree house which are covered with tree-roots, very creative. A lot of nice spot to take photos.","A must see for those who love to understand the arts and culture of Indonesia. The performance was interactive and casual. It was worth the money spent","A must see for those who love to understand the arts and culture of Indonesia. The performance was interactive and casual. It was worth the money spent"
"Really great looking around this place for 30 minutes and we had an enjoyable time. However, be warned it’s not easy reaching this place for anyone who likes a bit of comfort and a quick journey. From Bandung bus station we took a crowded mini bus to Ciwidey which seemed hard to…","This place worth a visit. To visit this place you need to hired your own transport, pay parking entry and a entry charge perhead. Easy hike to surrounding areas. You may spend around 1 hours here. If you have multiple visit of the day, make sure this is your 1st destination as…","You neèd to walk ....to view scenery. The problem of mine is coming along with young kid. to tired to walk.......overall this facility look good. but this place mainly for young traveller.","Instead of the second volcano we chose this attraction and I recommend it a lot. You can see indonesian puppet show, dance, costumes and than amazing playing the bamboo instrument.","Instead of the second volcano we chose this attraction and I recommend it a lot. You can see indonesian puppet show, dance, costumes and than amazing playing the bamboo instrument."
"When you first visit this place, you will amazed by how beautiful the crater color. This place name is ""kawah putih"" or white crater in English, but the real is the crater color not only white but it is depend on the sky color. When the weather is clear and sunny you can see the…","Rp200,000 per person even for my 3yo. Quite high priced. Beautiful picture taking opprtunities. Very cooling. Beware of the peddlers at the top. Some of them wanted to help us take our pictures and got angry when we declined even politely. They thought we think they might steal…","Great food and great atmosphere.  Fun park for kids under 12. Got my kid to play the entire day. The playground for the kids are great fun. Well maintain all sections. Maybe the toilet could be better clean. There not dirty just would be better and suited as all the other things…","An Indonesian friend in Jakarta told me that this show was a must-see in Bandung, so on my weekend visit there, I decided to see it on a Saturday afternoon.  Because of terrible traffic, I arrived about 10 minutes after the show had started, but I don't think I missed much. …","An Indonesian friend in Jakarta told me that this show was a must-see in Bandung, so on my weekend visit there, I decided to see it on a Saturday afternoon.  Because of terrible traffic, I arrived about 10 minutes after the show had started, but I don't think I missed much. …"
"This place is amazing & a must-visit in Bandung. Love the scenery - better than Tangkuban Perahu. Entrance free is much cheaper too. One thing to note the weather is cold, so bring along a sweater or jacket.","Visited the Queen Crater - nice scenery. However the entrance ticket of IDR200K is too pricey for foreigners. Also be careful with the peddlers there as they can rip you off trying to sell things to you - had a BAD experience with them!!","It's too crowded and hectic, the park have  10 points for kids and toddler to have fun all day long etc,  however they have poor service for public toilet and place to pray which is almost half of the population of indonesia are Moslem (mushola or mosque would be better!) and…","As this was optional in the package, we paid extra 100K for this performance as we heard it was popular. It was very good. There was also an angklung session where the guests gets to play and dance at the end. Interactive indeed. Recommended.  Irwanjoe #GCMSG @Gengcarimakansg","As this was optional in the package, we paid extra 100K for this performance as we heard it was popular. It was very good. There was also an angklung session where the guests gets to play and dance at the end. Interactive indeed. Recommended.  Irwanjoe #GCMSG @Gengcarimakansg"
"The view was exotic and one of a kind. Standing at the crater, it really is a geography student's dream come true! This spot is definitely an insta-worthy spot! However, please be careful of the sulfur puddles on the floor and not step into them, which I did <U+0001F602>","The entrance fee is quite pricey. Not many things can be seen or done here. Rp200k weekdays and Rp300k weekend you choose yourself. Beware of local sellers, they will follow you in every corner and place. Please do consider to buy what they are selling if you start to bargain.…","This place is very nice to bring your family and friends to interact with nature and relax. There are many great sceneries to take pictures as your background and complete with various attraction. However, it is very crowded on weekends. Full of locals from all over the place…","Great show!!! My family enjoyed it very much. They taught us how to play. It was fun and educational at the same time","Great show!!! My family enjoyed it very much. They taught us how to play. It was fun and educational at the same time"
"A must visit place while in Bandung. For me, it is better than Tangkuban Perahu. More nature, more scenic views and more cheaper. The price is Rp65k for foreigners and Rp35k for locals. This beauty volcanic lake sometimes mysterious in color. It looks like turquoise when you go…","No wonder that Tangkuban Perahu has a great view. Yet, the tickets are quite expensive for me. I rode my motorbike and spent IDR 47000 in the entrance only. When I wanted to visit Kawah Domas, one of the craters, I had to pay for another IDR 100000. This is the cost for a guide…","You'd better come in the morning of the weekdays to avoid the crowded.  So, I went there with my classmate for lunch and taking some pictures. The cafe is cool, the food is okay and the price is still reasonable for that kind of place. There are various spots to take pictures…","Do you know what an Angklung is?   It's an Indonesian traditional musical instrument made of Bamboo.   What happens if you have 8 of them tuned to a musical octave?   You get enough notes to make songs and harmonies.  So, we sit in the show, have the introduction, a great puppet…","Do you know what an Angklung is?   It's an Indonesian traditional musical instrument made of Bamboo.   What happens if you have 8 of them tuned to a musical octave?   You get enough notes to make songs and harmonies.  So, we sit in the show, have the introduction, a great puppet…"
"Amazing place on the ciwidey. My 2nd visit after 10 years ago. Definitely a good place for relaxing alone, with your mate, or families.   ","some sellers at tangkuban can be trusted, but some charge with expensive price,  if you interesting with some stuff you can bargain the price as cheap as minimum 50%   ","Facility is clean, hot water is really a treat considering the cool air.  Staff is helpful and polite  Bbq tools and bonfire included... yay","I personally think for 100,000 IDR is dirt cheap for a one and a half hour of programme and entertainment. It also allows you to participate in the program where they teaches you to play the Angklung and dance together!","I personally think for 100,000 IDR is dirt cheap for a one and a half hour of programme and entertainment. It also allows you to participate in the program where they teaches you to play the Angklung and dance together!"
"I went to White Crater with 8 family members. The place were under 20 degrees temperature, windy, nice and stunning, as you can take as many great photos because each angle was prefect. Children not advisable to visit here. Wear comfortable hiking shoes and thick jacket. It is…","Super expensive for foreigners. The ticket price is 10 times of the local(lucky you). Rp 200.000 on weekdays and Rp 300.000 on weekend for foreigner. You may check again the ticket in case they reduce the price.  There are 3 craters; Kawah Ratu (""Queen Crater""), Kawah Domas…","Mostly its about foods or maybe its only about foods. Very crowded on weekend, must queue to get shuttle from parking area. Various pay activities offered in here, must try eat in the tree eventhough must queue. While the menus in food stall just ordinary menus. But its a unique…","The show was really exciting. You can enjoy Angklung show here and learn how to play with it. The most important think, you will become part of the show in the angklung orchestra and the dance so you'll have great and fun experience there. ","The show was really exciting. You can enjoy Angklung show here and learn how to play with it. The most important think, you will become part of the show in the angklung orchestra and the dance so you'll have great and fun experience there. "
"Kawah Putih is quite pretty with its milky green lake. It is about 2.5hrs drive from the city center but was worth the journey for something different. The smell of sulphur was not overpowering so I did not get a mask but it does cost a far bit if you want to take the car up to…","200K/person and extra 45K with transportation- all the way to the top. Trekking down to Kawa Domas will cost u another 150K/person inclusive of tour guide commission. Going down you will be accompanied by sellers who are pretty nice and will provide simple service like massaging…","Its a huge area with lots of greens. We took the donut boat ride which was fun for the kids. Lots of beautiful background places to take photos. Kids fed bunnies, went inside a huge ballon and walk on water.. Had a blast. They also have strawberries pickings, horse riding etc.…","My family and I love the show very much, as well as my 2yo daughter, she really enjoyed the show. Really worth to visit, you can sing, dance and play angklung together. Do need any skill, just listen what the conductor say. This place also has a souvenir shop, including selling…","My family and I love the show very much, as well as my 2yo daughter, she really enjoyed the show. Really worth to visit, you can sing, dance and play angklung together. Do need any skill, just listen what the conductor say. This place also has a souvenir shop, including selling…"
"A must to come! Bring mask there as the sulphur smell is quite strong.  Overall, it is a place with stunning view ","Tangkabun Perahu is the icon of Bandung and it is ""must visit"" for every tourist that visited Bandung. But first and foremost please get ready for Bandung traffic jam as it could dampen your holiday visit to this place.  This place is located about 2 hrs drive from the city...of…","Such a great place for you who want to relax your mind after 5 days working, good view, ambiance, good food and good price..  Take your family time here, and you will never disappointed.","I went with a colleague who lives locally. The kids and the teenage + performers were amazing. Was totally blown away by the ability of the compere to converse with the audience in each of their own langues. ","I went with a colleague who lives locally. The kids and the teenage + performers were amazing. Was totally blown away by the ability of the compere to converse with the audience in each of their own langues. "
"It's a long way out and difficult to get to if you don't have transport but absolutely worth it if you can find a way. Beautiful hot spring source in a volcanic crater. Very strong sulphur fumes, be ready for this. Stunning views. It's a local must and you can visit the tea…","If your are foreigner. Please avoid this tangkuban parahu. Why u need to pay enormous amount for the sake of free view created by God. Share and show 'your' beauty. Facilities bloody unproper. IDR 300K (MYR90). Exclude parking/kawah domas.. Gila ka apa?   We do understand that…","get vacation in bandung we visit dusun bambu theyre located at lembang area the place was good with a view of some traditional restaurant 2 thumb up","A high octane performance of traditional and modern music by an amazing group of local children using local musical instruments. What made it all the more enchanting, besides their skill, was how much they all see,ed to be enjoying themselves. They even got the whole audience…","A high octane performance of traditional and modern music by an amazing group of local children using local musical instruments. What made it all the more enchanting, besides their skill, was how much they all see,ed to be enjoying themselves. They even got the whole audience…"
