"White_Charter","Tangkuban_Perahu","Dusun_Bambu","Saung_Angklung","Ciater"
"White Crater a.k.a Kawah Putih is one of the best Bandung Natural Park, Don't forget your mask to cover your lunge.  White Crater give you the view of white sand and green lake.  It's match for your prewedding photograph.","Entrance fee is abit expensive. Overall a good experience. U can boil an egg at the crater,and soak your tired feet after the hike to one of the crater. Recommended for visit. On a side note,beware of seller selling souvenier. Their price is on a high side and u get the things…","","everyone who come to this place has a chance to play bamboo musical instrument.  siting in the circle and hold the instrument then just follow the conductor when you shake the instrument  almost all the song is able to be played by all the guest by wonderful conductor and…","everyone who come to this place has a chance to play bamboo musical instrument.  siting in the circle and hold the instrument then just follow the conductor when you shake the instrument  almost all the song is able to be played by all the guest by wonderful conductor and…"
"One of the most beautiful place I have been to. It's a long drive from the city (we had a driver) but I find the view along the way so scenic. It's chilly so bring a light jacket or a wrap. The entrance has eateries, toilet with shower and a open area musollah. If you plan to…","I put an average because the price difference between domestic tourist and international tourist is 10 times more. As an international tourist, we don't mind paying more but not 10 times higher and what we have seen is rubbish everywhere. Plastic, papers, mineral water bottles,…","","a must visit place when you are in bandung, very entertaining, fun and engaging, great to see the sundanese culture and kids enjoying their performance","a must visit place when you are in bandung, very entertaining, fun and engaging, great to see the sundanese culture and kids enjoying their performance"
"This kind of leisure you can not miss. Its around 25km away from Bandung, West Java. The road to the place is a bit dangerous, the small roadt were up and down, you have to be carefull. In a way there, I stop in a restaurant, which name is Bebek Unti, they have a good meal and…","I had a terrible time finding information about this site online before going, so here is everything I found when I arrived: There are three craters in this park, you can walk to two of them along paths that are lined with small shops with crafts and snacks (check out the Batik…","","Don't miss it or you will regret it! We had fun! My friend took her teenage daughter along with us. No regrets at all..great entertainment.  The kids in the show were awesome! The guests were invited to join in the fun. Really a brilliant performance! ","Don't miss it or you will regret it! We had fun! My friend took her teenage daughter along with us. No regrets at all..great entertainment.  The kids in the show were awesome! The guests were invited to join in the fun. Really a brilliant performance! "
" <U+0001F600>: a special place to visit. We saw a couple doing pre wedding photoshoot there. Wondering how they could stand the sulphurous smell for few hours!  <U+0001F602>: itinerary was white crater, situ lake, hot spring and strawberry park. However after visited white crater and left for…","If you happen to visit West Java, specially Bandung, this is a must place to go. It's quite close to the West Java's capital and easy to reach, just 40 minutes. In Tangkuban Perahu you can see several tourist attraction such as Kawah Ratu crater, Kawah Domas crater, tea…","","It is much too commercial, but also fun to make. They are beautiful musical instruments for the children to play. Also, the dances funny to see. The tourists are brought here with lots of buses. The entrance fee is very expensive! They say it is a school, but it is more a fraud.…","It is much too commercial, but also fun to make. They are beautiful musical instruments for the children to play. Also, the dances funny to see. The tourists are brought here with lots of buses. The entrance fee is very expensive! They say it is a school, but it is more a fraud.…"
"It's really nice to see this Ciwidey White Crater, beautiful, quite unique and rare. It is sizeable highly acid lake which changes color from bluish to whitish green, and it's interesting to see different colors of the lake, but when I visited this place twice the color I see…","I have visited this attraction three times. This is one of the historical site that have its own story. If you want to know about the story, you can read a well known Indonesian folklore called Sangkuriang. The crater is believed as a ship that kicked out by Sangkuriang when he…","","We arrived a bit late due to congested roads. When we arrived, it was about 15 to 10 minutes before the show's end. However, credit should be given to them, we we're totally amazed with the performance especially on how they make traditional instrument become an international…","We arrived a bit late due to congested roads. When we arrived, it was about 15 to 10 minutes before the show's end. However, credit should be given to them, we we're totally amazed with the performance especially on how they make traditional instrument become an international…"
"It's a beautiful picturesque attraction. Lots of photo opportunities but be prepared to climb lots of steps. The crater  is not paved and there is lots of small stones. Heels are not advised! The trip up is winding but beautiful. The scene is worth the long long trip up. <U+0001F60A>","We go there with family by own car. The weather is good. very cool here. The Entrance is IDR 20K / person, and IDR 25 K / Car. My family think there is another place more interesting than this place. So we here just 30 minutes. Too many car and person.","","We really enjoyed this traditional musical performance which is designed to involve the audience. The kids all get involved with the performers in a dance session at the end. The session with the anklung was very entertaining and quite creative. They included well known 60s hit…","We really enjoyed this traditional musical performance which is designed to involve the audience. The kids all get involved with the performers in a dance session at the end. The session with the anklung was very entertaining and quite creative. They included well known 60s hit…"
"Among one of the famous volcanic crater in the city of Bandung .You can go down to the bottom of the crater but are advised to wear masks and not too long in the region of the crater because the smell of sulfur gas can cause you to feel nauseous and dizzy.","As the country of volcanoes, the ring of fire, Tangkuban Perahu is one of the still active volcanoes. Last erupted on 2013, the volcano is still safe to visit. The shape of the mountain is like a turned upside down ship-relating to a folklore. It has 4 crater and you can see…","","The show was so much fun and entertaining. Never thought that with angklung, you can play all kind of songs, in various genre.  So glad that they play many kind of songs, a proof that this music instrument is great! Proud to be an Indonesian!!","The show was so much fun and entertaining. Never thought that with angklung, you can play all kind of songs, in various genre.  So glad that they play many kind of songs, a proof that this music instrument is great! Proud to be an Indonesian!!"
"It took us about 3 hours to get here from Bandung by van.    According to our guide, this crater doesn't dry up as it always filled with water from underground.  The crater is approximately 100 meters in diameter.    You can walk from the car park to the crater and the distance…","I was very impressed with the beauty of this mountain & this is one of the active volcano in Bandung! The things that sold in the market was pretty cheap if we're to compare with floating market, but you have to try your very best in bargaining the price. ","","Overall it was very very entertaining. The music performance was so so lovely and beautiful. I really did not see this coming though, I thought it was just an okay angklung performance. But it was so beautiful. Don't worry if you don't speak Indonesia though, it is a very…","Overall it was very very entertaining. The music performance was so so lovely and beautiful. I really did not see this coming though, I thought it was just an okay angklung performance. But it was so beautiful. Don't worry if you don't speak Indonesia though, it is a very…"
"The crater is all that the images promise. Turquoise water, sulphurous smell (though, very mild an rare), as well as white sediment create an alien environment amidst the green forest.   We took an Angkot (local minivan) from the central bus station to ciwidey (IDR…","This trip takes a full day with an early start from Jakarta to avoid the traffic.  We hired a Grabcar for the day which was cheaper than the regular tours and gave us flexibility.  We went right up to the Ratu Crater, so no walking, and it was spectacular with plenty of photo…","","I must say I was a bit apprehensive at first, especially in the puppet show which kicks off the proceedings and was difficult to understand (but then so is Punch and Judy to non-English speakers). But then it was sheer delight, as firstly dancers came out and then the angkungs.…","I must say I was a bit apprehensive at first, especially in the puppet show which kicks off the proceedings and was difficult to understand (but then so is Punch and Judy to non-English speakers). But then it was sheer delight, as firstly dancers came out and then the angkungs.…"
"Driver told us usually it would take 2-2.5hours to reach Kawah Putih. But we visited this place on Sunday (CNY eve). It took us 4 hours to reach Kawah Putih due to jam along the way.  We spent less than 10min coz there is basically nothing except strong sulphur smell. Huge human…","This visit could be a good one... But the street salers were very harsh and  overwhelming.   It's a long trip from our hotel.  We ate grilled corns, bought photos, bought some fruits, ride horses and bought some souvenirs.   We Always try to support local business... Whish it…","","LIKE : eventhough i don't play angklung..but the show is true entertaining cultural show. DISLIKE : NA","LIKE : eventhough i don't play angklung..but the show is true entertaining cultural show. DISLIKE : NA"
"It's a beautiful place! But seriously though, pictures make it look SUPER AMAZING, while in reality it's not that amazing. And you shouldn't stay there too long, 30minutes max, otherwise you'd end up huffing and wheezing the next hour or so. It's a great place to take pictures,…","My husband need to drive about 45km from city. There nothing to do.. just chillin' with some of fresh air n taken photos for memories.  The merchandise sellers quite annoying but what we can do? They r earn from that.  For view its just okay... like a normal mountain area but…","","This attraction is a 20-minute taxi ride from Jalan Braga area and a bit outside the main city area. The entrance fee is 110k IDR for foreigners which includes a free drink or ice-cream.  The staff is polite, friendly and professional, and the performances are enjoyable and…","This attraction is a 20-minute taxi ride from Jalan Braga area and a bit outside the main city area. The entrance fee is 110k IDR for foreigners which includes a free drink or ice-cream.  The staff is polite, friendly and professional, and the performances are enjoyable and…"
"I went to white crater on sunday, a day before lunar year. The traffic is very bad. Since the road is very small, and many cars and buses were there for vacation, traffic jam happened for >4hours inside ciwidey. I was intended to go out on 4pm and i successfully reached…","This place is a popular destination for tourist. Tangkuban Perahu is an active volcano, with outstanding scenery. There are many souvenir seller who actually very friendly and will offer to help you take picture. But after that they will try to sell key chain, bracelet, toys, or…","","I have been there 3 times and each time was like a new beginning for me. Almost everyone plays and owns at least a set of Angklungs, A musical instrument made from bamboo. But Saung Angklung Udjo is somehow different. Their mission and determination sets them different from the…","I have been there 3 times and each time was like a new beginning for me. Almost everyone plays and owns at least a set of Angklungs, A musical instrument made from bamboo. But Saung Angklung Udjo is somehow different. Their mission and determination sets them different from the…"
"After all these years, I just got a chance to visit Kawah Putih (White Crater) recently. Since the only spare time I have is during weekend, I went there along with my friends. From Jakarta the trip took almost 6 hours. We arrived there almost noon. The smell of sulfur sometimes…","According to our tour guide, the name ""Tangkuban Parahu"" is a Sundanese language, literally translate as upturning boat, referring to the local legend of its creation. The weather was nice. There's also some shops sell sourvenirs including rabbit's fur hat. ","","Wonderful show by some very talented musicians (including some very young children!) Getting to join and play the 'angklung' was a great experience.","Wonderful show by some very talented musicians (including some very young children!) Getting to join and play the 'angklung' was a great experience."
"Famous with pre wed photo shoot, this crater is indeed beautiful but it could be a bit crowded during holiday time. The air around crater also not so good for asthma person. ","I went to Kawah Ratu (Ratu crater), the most famous spot for tourists to take pictures. I was quite disappointed because as an active volcano, it erupted several times so the form keep changing. This year, the geyser had stopped, so we hardly could see any nice blue lake in the…","","In here you can see an Aklung Perfomance, Shadow puppet attraction and also Traditional dance perfomance. Saung Angklung Mang Udjo can make Traditional Instrument art become a international taste and its well performed buy the artists. I've watched this attraction for 2 times…","In here you can see an Aklung Perfomance, Shadow puppet attraction and also Traditional dance perfomance. Saung Angklung Mang Udjo can make Traditional Instrument art become a international taste and its well performed buy the artists. I've watched this attraction for 2 times…"
"This place is so faaaaaaaaaaaaaaar, but the view you got is a full payback for the effort. A beautiful white crater in front of your face. Its a large crater, a little bit like a lake but its a crater so be careful. The suggestion is you only allow to stay near the crater for…","I enjoyed looking around the crater. We went on a longer walk around it and hardly saw anyone else. Further along a guide will offer to take you down to the lakeside, which we didn't do. In retrospect his suggested price of 100K was expensive as well so you might want to try…","","I give two thumbs up for Saung Angklung Udjo because they make traditional instrument becomes international taste.  They perform not only music but dance and make audience interactive with the angklung instrument. They give us the angklung one by one and at the end of the…","I give two thumbs up for Saung Angklung Udjo because they make traditional instrument becomes international taste.  They perform not only music but dance and make audience interactive with the angklung instrument. They give us the angklung one by one and at the end of the…"
"very beautiful natural crater in Bandung, a bit far from city centre. How to get there: Exit at Kopo Toll Exit, turn right and then go straight approx. 1 hr, and find direction to Ciwidey. many places to visit at Ciwidey, but Kawah Putih definitely one of the best place to…","Just enjoy the view and there was nothing to do. We took some pictures for memories and then went back to city. To enjoy more, you must do some trekking there. ^^","","It has been more than three times I came here. In addition to easy access is achieved, the attractions of the children and the Angklung's players is very exciting. We not only watch, but also come into play Angklung. It's better to come in the afternoon and do not forget to buy…","It has been more than three times I came here. In addition to easy access is achieved, the attractions of the children and the Angklung's players is very exciting. We not only watch, but also come into play Angklung. It's better to come in the afternoon and do not forget to buy…"
"We were going there in 2015. We went from jakarta at 5 am and arrived there around 8am. It is beautiful if you arrive there early in the morning like we did. Don't forget to bring your own mask there because they will charge you idr 5k per mask.","First, it is WAY out of Bandung! Second, its packed with people! Third, the most annoying...locals trying to persuade you into buying their merchandise! Fourth, its too expensive...rp200000/pax! I wont recommend this place. Its better to go to Kawah Putih for a more up close…","","The Saung Angklung Udjo is a performance with music,  dance,  wayang puppet play and a friendly interaction with the audience.  It is of course commercial,  but the children playing and dancing and their families benefit also from these performances. The traffic in Bandung is…","The Saung Angklung Udjo is a performance with music,  dance,  wayang puppet play and a friendly interaction with the audience.  It is of course commercial,  but the children playing and dancing and their families benefit also from these performances. The traffic in Bandung is…"
"Ciwidey is far enough from center of Bandung City. But, when you arrived in White Crater, the scenery will make you totally stress released. The staff and management is pretty good.","Visit this amazing vulcano, mountain tangkuban perahu. Its was amazing view from the top. My daughter love it very much, especially when she got the tour by ride a horse. Recomended place to visit","","I got a lovely experience here. What a beautiful instrument. They gave us an Angklung for being part of the show. ","I got a lovely experience here. What a beautiful instrument. They gave us an Angklung for being part of the show. "
"The journey here was horrendous but well worth it! Had to pay my guide extra to bring us here. The beauty is remarkable. I immediately googled and read up on it once i left the place. It is amazing how the colour of the lake is this blueish/greenish colour. I came when there was…","The sight of nature here is amazing. You can still see steam coming out of the parts of the crater. Tangkuban Perahu is more than 2,000m and was to have last erupted in 2015. A gentle warning for those who intend to bring the elderly - there are quite a few steps and a majority…","","I especially liked the interactive segment where all the audience get their own angklung and play according to instructions of the angklung maestro. ","I especially liked the interactive segment where all the audience get their own angklung and play according to instructions of the angklung maestro. "
"#NAME?","Entrance fee for tourists is Rupiah 200k compare to local at Rupiah 50k. On top of that , u still need to pay Rupiah 50k for car entrance fee!! Told by local the price increases when it was privatised. Local only pay Rupiah 50k.","","Angklung is a music tools that is made from bamboo. It has a very unique sound and it makes your mind peaceful. Go to Saung Angklung Udjo and pays about 100.000 but I think it is worthed beacuse you can't see something like this in anywhere else.","Angklung is a music tools that is made from bamboo. It has a very unique sound and it makes your mind peaceful. Go to Saung Angklung Udjo and pays about 100.000 but I think it is worthed beacuse you can't see something like this in anywhere else."
"We took almost 2 hour from Cihampelas to reach here. Actually the distance is within 40km but it was so jammed. Before reach the peak,we stop by for welcome drink. Please try their otak-otak. It was so delicious as we can't stop eating and ordering. The strawberry from Street…","I was lured in the with pictures from the colored lake, but as it turns out its very grey, and barely a lake. So if you want to go there for the view of the crater, don't. However, if you like a little bit of hiking you will love this place. The air is very clean and fresh…","","This performance is a perfect combination of instrument playing and dancing by children in beautiful costumes.","This performance is a perfect combination of instrument playing and dancing by children in beautiful costumes."
"We travelled about 2 hours from Ciumbelieut to Kawah Putih, and all I can say is that its worth the trip.  The main area itself isn't that big, but there's something about the milky bluish-white lake that makes you keep staring and looking around in awe. As we are very high up…","Not a good experience.  They gouge you on the price.  It is 100,000 rp for each person plus 25,000 rp for parking the vehicle.  We parked at the upper parking area where an official tour guide will immediately approached us and took us to the tour office.  There, they charged…","","Always loves the place- great cultural show! The kids like it and cant stop to play angklung at whole time. Definetely a must visit when you are in Bandung.","Always loves the place- great cultural show! The kids like it and cant stop to play angklung at whole time. Definetely a must visit when you are in Bandung."
"nice view even though the smell is quite unpleasant (due to sulphur or something like that. we can only stay for a while because of the sulphur ","took the mountain shuttle from our bus to the top of the tourist spot where there are horse riding in the cold and misty morning.   I was not prepared for the cold temperature and it is always good to bring along a jacket if you are visiting in the morning. Had a local guide…","","suitable for kids and people who wants something different.. they will teach you how to use Angklung - bamboo music equipment. need to try.. ","suitable for kids and people who wants something different.. they will teach you how to use Angklung - bamboo music equipment. need to try.. "
"Breathtaking views albeit a little foggy but then again, what a view!!! It's quite chilly up there so make sure you are properly dressed and of course, for safety reasons, wear a mask to protect yourself from inhaling too much sulphur! And of course, for a better experience, go…","It's quite amazing to walk around the whole park and see the crater in action. Be wary of the peddlers though, a firm no usually worked but i felt it spoiled my experience a little. Personally I also felt 'Kawah Putih', 1.5hrs drive away was more stunning visually. ","","A great place to explore Indonesian culture. Fun audience participation. Love all the kids, and their performance. ","A great place to explore Indonesian culture. Fun audience participation. Love all the kids, and their performance. "
"It is a very beautiful view. Like a lake in white sand. It was very chilly especially when wind come. You need a jacket or sweater.    Most people just watched, enjoyed the view and took some photos. That's the only we could do in the site.  To get the crater, we needed to drive…","We took about 1 hour ++ from Bandung to reach Tangkuban Perahu (depends on traffic). It is located near Cikole Lembang, tea plantation & strawberry farm so you can do side visit after that.   Since Tangkuban is touristy, the ticket charged is pretty expensive if you ask me.…","","This is a working musical school so the performers are students and do an excellent job.  The audience also gets a chance to join in with simple angklungs and we really enjoyed the whole experience.  The variety of musical scores that this instrument can play is amazing.","This is a working musical school so the performers are students and do an excellent job.  The audience also gets a chance to join in with simple angklungs and we really enjoyed the whole experience.  The variety of musical scores that this instrument can play is amazing."
"Kidding! There is no zombies like those on walking dead. Zombies define the sellers there. They will sell you to rent their umbrellas, keychains, etc. It was drizzling there, so we rented from one of the vendors for 50k rupiah. Down at the crater there will be many photographers…","A good place to visit and see the volcanic craters. We drove up to the top of the mountain. Kawah Ratu is the biggest crater and visitors are able to view it from the car park.  Kawah Domas is located about 45 minutes walk down the mountain. I had the same experience like most…","","The performance from all the students of Udjo school are awesome! You will have an opportunity to play angklung together. Make sure to come on time. The evening show will start at 1530. Do not come too early as you won't have anything else to do there.","The performance from all the students of Udjo school are awesome! You will have an opportunity to play angklung together. Make sure to come on time. The evening show will start at 1530. Do not come too early as you won't have anything else to do there."
