"White_Charter","Tangkuban_Perahu","Dusun_Bambu","Saung_Angklung","Ciater"
"It so amazing , it was so beautiful.  White crater with the fog surround them. You will never forget it.","A volcano hill that still active in Indonesia.You can enter here with entrance fee.Don't miss this popular tourist spot in Bandung.Don't forget to bring along the face mask especially if you have asthma etc.","Good outing but way too crowded especially since you have to wait for shuttle to bring you up. The nicest part is the manmade lake surrounded by mini houses. Remember to redeem your free water that comes along with your ticket. ","We visited the Saung Angklung Udjo show at 330pm. By the way, there is only 1 show per day. Please also get  your hotel staff to check if there is a show on the day that you plan to watch. I gather from the show that on adhoc basis, the group may perform outside of Indonesia.…","We visited the Saung Angklung Udjo show at 330pm. By the way, there is only 1 show per day. Please also get  your hotel staff to check if there is a show on the day that you plan to watch. I gather from the show that on adhoc basis, the group may perform outside of Indonesia.…"
"Cool/cold you better bring along raincoat or jacket and umbrella as well. Strong smell don't stay too long, drink morex water after visit.","This mountain volcanoes is certainly worth visiting at least once. I have been twice, both times on a week day which meant fewer crowds. Both times using my KITAS which allowed me local price without much problem.   They tried to trick us the first time but we were informed and…","This place gas a great view. You can also do such activity like archery and shooting.  But, the food is poor and the food price is very expensive.","Was recommended to watch this traditional musical by our driver and we never regret going for it.  Paid appx $11sgd per pax & was entitled to free popsicles/mineral water. Host speaks great English which makes it so much easier to understand enjoy the show (as my partner and I…","Was recommended to watch this traditional musical by our driver and we never regret going for it.  Paid appx $11sgd per pax & was entitled to free popsicles/mineral water. Host speaks great English which makes it so much easier to understand enjoy the show (as my partner and I…"
"the admission was rather expensive as for my pte driver to drive in with my son and myself cost a hefty 250k ruppiah.the masks were not necessary for me but lucky it was quite cheap at 5000 ruppiah only.but we drove very long to reach the sulphuric lake..i heard the live volcano…","Foreigners pay 10x the price of locals, nice way to rip-off money. Not worth it, even with champagne on the volcano. Indeed a turist trap.","went to dusun bambu with my husband's families. it was a beautiful place with nature environment. the air was so fresh and the view were very beautiful,especially there is a small river and lake.also provide many kind of foods at the restaurant. great experience","A bit off from city centre... But we came over from our trip to Tebing Keraton and Taman Hutan Raya Ir. H. DJuanda... So it is relatively near... Shows at 15:30 to 17:00 everyday, all year round as they put it... IDR100k per entrance for foreigners... In, for Local Arts???…","A bit off from city centre... But we came over from our trip to Tebing Keraton and Taman Hutan Raya Ir. H. DJuanda... So it is relatively near... Shows at 15:30 to 17:00 everyday, all year round as they put it... IDR100k per entrance for foreigners... In, for Local Arts???…"
"An experience not to be missed. It is about 15-18 C. Better bring something warm. Remember not to take the back seat of the shuttle bus that brings you to the peak. Bring along a mask if you are afraid to breathe too much of the sulphuric air. Smell of unburnt petrol and…","I came here together with my family about a year ago. The only thing that I really didn't like were the people around you, will keep trying to sell you something. My tip for this is... go with a local tour guide they'll either help you to negotiate or tell them that you are not…","Nice place to bring family and young children. Nice playground, and have alternatives place to relax. Food is quite nice, with reasonable price at the food court.","If shopping is not your main itinerary in Bandung and curious to know basic Indonesian culture particularly angklung, please allocate at least 2 hours for the musical performances.  The shows began with myriads of musical shows with children (students of this academy)…","If shopping is not your main itinerary in Bandung and curious to know basic Indonesian culture particularly angklung, please allocate at least 2 hours for the musical performances.  The shows began with myriads of musical shows with children (students of this academy)…"
"Totally worth to visit if you have never been to a crater. Awesome scenery. But the pungent smell from the crater lake is awful, you might want bring a scarf or face mask. ","It's really a hit and miss for me. On 1 hand, you get to see a live volcano. On the other hand, it is so crowded that you are looking more at ppl than the volcano. And once you taken the necessary photos or selfie, that's it. It is a bit more interesting if you take the hike to…","It's a good getaway place with friends or family, not too far from Bandung city. They have several restaurants that offer nice view (inside the bird nest or at a lake side). They also have various playground for kids: mini zoo, maze, archery, strawberry picking. On top of that…","this was just amazing the Angklung is a traditional Indonesian instrument made from bamboo.  The sound is distinctive and pleasant.  The show went for an hour and a half and at first I was worried because it consisted of one man controlling some puppets that started fighting it…","this was just amazing the Angklung is a traditional Indonesian instrument made from bamboo.  The sound is distinctive and pleasant.  The show went for an hour and a half and at first I was worried because it consisted of one man controlling some puppets that started fighting it…"
"Kawah Putih ( white crater) has a very great view. Unfortunately when we were there, it was heavy rain, so what we could saw was really limited by fog. ","But then the entrance fee of 30,000 can be multiplied by 10 times for farangs. So go with a local friend to avoid this scam or you can go early in the morning before the guards come. There should be no fee to get to the top. The trail can be from the lava flowed hole so just…","Nice mountain scenery with beautiful flower park. The supporting like restaurants, kids playground not good.","whether you are a traveler or into the music, this is one place you should not miss while visiting Bandung. I gave ++ for this attraction. In this place you would learn more about traditional music Angklung of west Java. They let you play one of them, too. Don't forget to buy…","whether you are a traveler or into the music, this is one place you should not miss while visiting Bandung. I gave ++ for this attraction. In this place you would learn more about traditional music Angklung of west Java. They let you play one of them, too. Don't forget to buy…"
"Nice cooling place. Needed to wait for the fog to clear to get a better picture with the mountains behind the white crater. ","At the gate of the volcano park locals pay 30 000 and foreign tourists pay 300 000. That is not acceptable. Do not go on Sundays as the whole spot is overcrowded. Way back to Bandung costed us 2,5 hours. The volcano and the hot springs are worth to see but surely not for this…","Its a truly leisure park either with family or friends. A unique concept in a huge areas supported with villa's, restaurant, playground for children, market spot and beautifull view. Variety menu's of Sundanessee will satisfy your stomach with suitable price.","Bamboo music, traditional dance and wooden puppet show. Good cultural experience. The participatory Angklung playing experience is unique.","Bamboo music, traditional dance and wooden puppet show. Good cultural experience. The participatory Angklung playing experience is unique."
"Breathtakingly beautiful scenery. Worth a drive to see this beautiful tourist attraction.It was a volcanic crater situated roughly 50 km south of Bandung. The low pH and Sulfur created this gorgeous Aqua color lake.","I wanted to visit as this is one of the most popular site near Bandung.The crater and surrounding area are natural beauties but not the best compared to other craters in Indonesia.   The first ""trap"" are the touts. They will follow you around and act helpful , before trying to…","Very good for kids. Nice set up.  Clean and good management. Definitely will go back for kids.  Sadly some play houses are not accessible to enter,  just stopped in front. ","Saung angklung Udjo is the best place when you want to hear somethin new harmony for your soul and life. Its traditional musically orchestra from Bandung, West Java, Indonesia. You can hear, learn and play a new music and soon renewly charging your soul and mind. Dont miss this…","Saung angklung Udjo is the best place when you want to hear somethin new harmony for your soul and life. Its traditional musically orchestra from Bandung, West Java, Indonesia. You can hear, learn and play a new music and soon renewly charging your soul and mind. Dont miss this…"
"Wonderful to see, such special colours and the smoke makes it magical. Vus rids up there is also quite an adventure. It does rain a lit and super hard so take something for the rain!","we are not allowed to walk down to get close to the volcano site... however you can click pretty good pictures... walk up the hill for an awesome view ...the walk up may be a little steep and you got to be careful with your steps...besides that, there is pony rides available for…","avoid to come during holiday, as it would be crowded! specialty: dining in the cage, need to do reservation first. there is a toilet cage as well! quite a lot of activities can be done: ATV, archery, boat ride, walking in the park, strawberry plugging, children playground woth…","This is third times i came here but still amazing.. I really enjoyed the show.. If you want to sea some attractive, beautifull, and traditional show.. Come to saung angklung udjo and i promise you will never regret it..  ","This is third times i came here but still amazing.. I really enjoyed the show.. If you want to sea some attractive, beautifull, and traditional show.. Come to saung angklung udjo and i promise you will never regret it..  "
"Beautiful view and the ticket price is cheaper than Tangkuban Perahu. Sulphur smell is quiet strong so get your face mask ready. ","Gorgeous spot, no doubt, with picturesque scenes and great photo ops. However, the entrance ticket is terribly expensive for foreigners. The touts here, disguised as kind local guides, are ruthless and use emotional blackmail and play on your sympathy to make a quick buck. They…","Back to nature... im enjoy to visit this place... have beautiful view.. must try this place if you visit bandung","We have always wanted to come here. Every time when we are in Bandung we would include the 3.30pm show in our itinerary. Unfortunately, we would cancel it each time due to our time management and traffic jams.  On one Friday afternoon in September, we managed to come here for…","We have always wanted to come here. Every time when we are in Bandung we would include the 3.30pm show in our itinerary. Unfortunately, we would cancel it each time due to our time management and traffic jams.  On one Friday afternoon in September, we managed to come here for…"
"This place is good for taking a picture and so many people sell many sovenir at this place, ad some foreign come to this place","A day trip here.... Nice view from the top of the volcano.... Lots of things sold here..... Must go if in Bandung...","Enter this place you have to pay around 15K..they provide a car to bring you from front gate into restaurant area..there are  also hiking ground, camping hotel, children playground, restarurant which divided into 3 main area, canoing, boat. We ate in Saung area..in saung area…","I came to Bandung this time to attend the conference.  The organizer had organized a one day city tour which included a visit to this place.  It turned out to be the best of the one day city tour.  The show were fascinating.  I think the auduances enjoyed a quick lesson on how…","I came to Bandung this time to attend the conference.  The organizer had organized a one day city tour which included a visit to this place.  It turned out to be the best of the one day city tour.  The show were fascinating.  I think the auduances enjoyed a quick lesson on how…"
"It's fairly easy to navigate, you go to the 'ticket box' at the back of the car park.   PRICE We read a lot about different prices. It's much cheaper for local but we are happy to pay a little more for the tourist price.  We payed 50.000 each for a ticket and a further 15.000…","Tangkuban Perahu are known best for the scenic views that surrounds the crater. It is also one of the famous attraction for pre-wedding photoshoots.","We reached Dusun Bambu pretty late in the afternoon, by then most of the attractions were already closing (wished the staff at the entrance would have informed us, though).  The compound is very well managed - shuttle bus with high frequency, clean washroom and well-managed…","Nice space to learn about Indonesian traditional instrument. The tour include briefing on the history of the place and later watching performance from the children and teenagers at the centre. We were given traditional ice cream 'es lilin' while watching the performance.  After…","Nice space to learn about Indonesian traditional instrument. The tour include briefing on the history of the place and later watching performance from the children and teenagers at the centre. We were given traditional ice cream 'es lilin' while watching the performance.  After…"
"Entrance to the crater only opens at 8am. You will need tickets to get up the crater as you will need to take this open air minivan to shuttle you to the top. The driver will insist that there are 4 people per seat and will not go off unless the van is a full house. Once on top,…","I've always love mountain and that's why I love Tangkuban Perahu but my visit was unfortunately was during a holiday season thus the place is packed with tourist. Such a shame that a beautiful place like this is full of trash and street seller which makes it messy and hard to…","I visited this leisure park with a friend. We rode a small motorbike. It was a pleasant ride from the hotel. The air was cool & refreshing despite the traffic jam while in downtown bandung. This park is on a higher ground than bandung. Recommended for taking photos & selfies.…","This is my first time to coming here ""The Saung Angklung Udjo"" that located is in centre of West Java at Padasuka Street. I have to going with my all group from company working. We are spending time here almost 1,5 hours, I saw any actraction from of few traditional dance and…","This is my first time to coming here ""The Saung Angklung Udjo"" that located is in centre of West Java at Padasuka Street. I have to going with my all group from company working. We are spending time here almost 1,5 hours, I saw any actraction from of few traditional dance and…"
"One of the places with very nice view, you might spent 30 mins - 1 hour here. The view is very good at anytime of visit. - Distance between car park and crater is up to 10 minutes driving, the place provide traditional shuttle/vehicle - No food stall in the crater, but there is…","It is famous since ages a go At least you need to go here once Although not too much to see, but of I go here, I hunt for strawberry or  They sell lots, seller will come to you, just do the bargain Then I will blend it at hotel (bring your handy juicer)  But I would surely love…","This is for group/family vacation, many options to dine or just relax. Meals are available at Pasar Katulistiwa. Selfies's playground.","This is second time i watched angklung performance and i don't feel boring. and i interested with children dance and invite tourist for dance together. They are so cute and care. So you have to schedule to come here! :)       ","This is second time i watched angklung performance and i don't feel boring. and i interested with children dance and invite tourist for dance together. They are so cute and care. So you have to schedule to come here! :)       "
"White Crater (Kawah Putih) in Ciwidey is a very photogenic location, which makes it a favorite for pre-wedding and themed photography. This site is far to the south of Bandung city, with winding, small albeit smooth access roads. When we got there the sulphuric cracks were…","Tangkuban Perahu offers a beautiful view of active volcano. They also have Kawah Doma. However, we disappointed with the tour guide. As we need local tour guide to Kawah Doma, so we took local tour guide on the spot who was official tour guide officer (they will show you the…"," This is our firat experience as a family camping in Dusun Bumbu. The area allocated is suoerb with loa of greenery and semi forest area. The place is very well maintained and the staff are vwry polite and ready to assist you whenever you approach them.for direction or…","Great experience playing the angklung. If you're looking for the express cultural experience, this is where to go. Awesome!","Great experience playing the angklung. If you're looking for the express cultural experience, this is where to go. Awesome!"
"1st experince to Kawah Puteh. Loving it. Beautiful view. Natural. my family loves the place too. Nice place to have photos taken. They have camera mans there. But of course with charge not free.. Price affordable price.","To be honest,this is also the first time with my family. We went there with my family. Most of people wanted to see is the crater but too bad we cannot go further inside of the crater except another crater called domas crater. And since the traffic jam from Lembang is quite bad,…","This is the first time we took our sons camping. We were enjoying our time there, the tent is good, clean and comfy. They have a very clean and private restroom for every tent. We enjoyed the barbeque at night with api unggun there.  In the morning we were amazed by the view and…","Very cultural and fantastic performance highly interactive. Parking is easy? Travel to the place is bit far but worth it. ","Very cultural and fantastic performance highly interactive. Parking is easy? Travel to the place is bit far but worth it. "
"This was my first time to this crater. The journey took about two hour from city center. We read all information about this place first. There has upper and lower parking and surely, park your vehicle at upper side is expensive. We ask our driver to park at down side. The price…","we took 2hours to get there just to see a place that look like a disused quarry. We are out in 30mins later. There is other better place than here.","A beautiful, serene and relaxing place to go to enjoy Bandung's beautiful mountains. Was not able to fully enjoy the park as it was raining very, very heavily when we were there. Will definitely visit again.","This is an incredible entertaining and funny place. The whole show was really amazing listening to these instruments. Personal highlights... the audience was introduced how to play and achieved playing songs as a big group. ... The last pop performance of the gifted ones that…","This is an incredible entertaining and funny place. The whole show was really amazing listening to these instruments. Personal highlights... the audience was introduced how to play and achieved playing songs as a big group. ... The last pop performance of the gifted ones that…"
"Came here during rainy season, I cant see the crater clearly because of fog and windy rain. Suggest you bring your own umbrella & mask so you dont have to rent. Not remember how much entrance fee because I came with large group. Very good place to take some photo & video and try…","It opens at 7 am. That's the best time to see Tangkuban Perahu, It's very clear scenery, no fog.  I come here for several time, but usually at noon time. This time is the best. Because if we come here a noon or afternoon, we can't see the caldron clearly, it covered by…","this place is ideal for those who are looking for a relaxing weekend out of jakarta. Closer to bandung and being on height, the weather is ideal for a day out with family.  Man made lake, surrounded by huts which are used to relax or have lunch. One side of the hut opens towards…","Learn and study about local culture. This place is highly recommended. Angklung ( bamboo music tool) produces sound very nice and in love with this place.","Learn and study about local culture. This place is highly recommended. Angklung ( bamboo music tool) produces sound very nice and in love with this place."
"Entrace fee 20.000 rupiah per pax.if you want to bring your own car to go to inside you have to pay 150.000 rupiah. Or you have to use ..uhm like open pickup share with others with price 15.000 per pax. The view is nice. If you come when fog down just waiting then you will see…","Located outside of Bandung city,traffic jam at the weekend. The ticket is cheap for locals about $2.5, but 10 times of the price for foreigners. The volcano view is unique, some sellers sell local souvenirs, they are quite attractive. If you has never seen the volcano, you may…","Highly recommended this place who love nature likes me. U can saw many cages is build from twigs of trees. ","If you're a fan of good ethnic music you have to come and visit this.  For a fair price of fare you will enjoy a series of performance in a serene theater that at first you won't believe exist in the middle of a big city.  The opening performance is a puppet show in traditional…","If you're a fan of good ethnic music you have to come and visit this.  For a fair price of fare you will enjoy a series of performance in a serene theater that at first you won't believe exist in the middle of a big city.  The opening performance is a puppet show in traditional…"
"This is a lake formed in the crater of an active volcano. One can see the burnt trees and shrubs on one side, high mountains peaks on the other and this quiet large lake which is absolutely green due to the chemicals like suiphur. One can still see some sort of smoke emerging…","Amazing view of the Ratu crater. Nice scenery with good photo taking opportunities. Bring a mask if you think you will be bothered by the sulfur smell. The place can be windy and chilly so bring along extra clothing or a shawl. There were street peddlers everywhere, offering…","We stayed at 2 big ""double room"" tent. There's 2 campfire   Upon arrival we must do the flag ceremony and sang our national song. Surprisingly there's wifi! The restroom was not bad, there's hot water and some amenities. But dont expect too much.  Our camp was in a private area,…","There are about 8 different performances including Wayang Golek (traditional Sundanese puppet show), traditional Angklung performances and cultural dances. Definitely worth a visit when you go to Bandung. There is also a shop at the location where you can buy the wayang golek…","There are about 8 different performances including Wayang Golek (traditional Sundanese puppet show), traditional Angklung performances and cultural dances. Definitely worth a visit when you go to Bandung. There is also a shop at the location where you can buy the wayang golek…"
"IT'S A CRATER!! Before anything, please take the time to realize how AWESOME that is! The fact that we can actually step in into a crater and marvel at its beauty is one of the things you should put on your bucket list indeed. So here's how it goes. From Bandung City, I took a…","A popular tourist spot located in the north of Bandung. A one hour car ride from the city takes us to this volcano crater. There were some persistent tourist touts and sellers around but we just ignored them. As long as you don't talk to them, they will leave you alone after a…","It is the newest attraction in the hilly Lembang area of Bandung. The climate is so fresh and lucky us is not raining at that time. The concept is bamboo conservation and many bamboos are used for ornaments and stuffs. It represents 7E philosophy : 1. Ecology 2. Education 3.…","Very entertaining, educational and fun. Play angklung, dancing together, and learning about angklung in the most exciting way...","Very entertaining, educational and fun. Play angklung, dancing together, and learning about angklung in the most exciting way..."
