"Fort_Rotterdam","Losari","Bonerate","Bantimurung","Bira"
"Fort rotterdam is one of must you visit in makassar. The museum they have true story and you can asking the guide here. ","Very disappointing area as despite the boulevard there is not much fun spending your time here. When you think of ""beach"" you would expect  some ""nice white/black/at least clean sand"" or not?","","",""
"a good place to visit. we should appreciate what history made for our generation. the building maintain good, clean and safe to visit.","Losari beach is one of main attraction in Makassar. It was crowded most of the time, because locals like to take picture in its famous signage. There was a lot of statues of heroes and things related to Makassar history too. It was also near other attractions such as Rotterdam…","","",""
"you can combine this with losari beach. its an old kolonial building with a Dutch history. just walk around and enjoy. i was here in may 2014","the beach was just walking distance from the hotel, with large letters in red which is good for photos. You cannot swim at the beach, and it was a bit dirty,","","",""
"It is told that one of my uncle was born within this fort. It reminds me of Galveston when visiting this place. Different is, they don't sell any food. Nor any civilization anymore evolved here. It's always good to respect the old memories isn't .","This place could be better if there's no trash lying around anywhere. When I visited this beach, I was a little bit uncomfortable due to the ammount of trash (plastic bags, plastic bottles, etc.). However, this place has a beautiful mosque.","","",""
"Lack of garbage point make the site dirty. Cigars, plastic, you can found in any corner. my last visit here was 2012, and it changes a lot. Please dont let our historycal a junk yard","The beach has interesting architecture with nice pavilions and huge letters. It is good for photo shooting and the good old selfie spots. Along the beach has other attractions such as a beautiful mosque, nice street coffee shops and a good jogging track. There are also numerous…","","",""
"The admission fee is only Rp. 5.000. You can explore the Fort and also the Museum inside. Thera are a lot place to cover here for Photo Spot. Nice place","Easy enough to reach, you can take pictures from every angles.  Good view and there is also floating mosque nearby","","",""
"a very simple, clean and historical place a must to visit. unfortunately, lack of reading or sign to grasp some knowledge about the scene. the entrance is totally free.prior to registration for visitors book. opposite the site is commercial for hotels, souvenirs, banana boat and…","Rather misleading & confusing name, that many people would think this place has a white sand or something like 'ordinary' beach (pantai) but after they go there, it has no sand like 'ordinary' beach (pantai) must, so it can confuse many people who never visiting this place…","","",""
"Love the location and the architecture. I can't find this great architecture in my home (Jakarta). I tried to catch this Fort while I was doing business trip, it took only 5 minutes from my hotel (Aston). If you have time you can go to mini port in front of the fort and try to…","Heads up...not a beach as such...no swimming. Its a common meeting place and very much comes alive in the evenings. Plently of food to be found.","","",""
"I took the unguided option, which means the only two points inside of interest, other than a general walk around, could be the 2 musesums. The smaller, very small museum is completely in Bahasa Indonesia, whilst the other larger museum also has English translations. The larger…","It is the one if the best pleace to hangout in Makassar. You can find lot of typical food here such as Pisang Epe with lot of taste, es teler, coto makassar, etc. For the people who like potografi, it is the right place with all typical houses in South Sulawesi such as Toraja,…","","",""
"history entertainment, bring your camera and find some good spot. some tips; dont go there at the noon. it was sooooo hooott","It's the landmark of Makassar. Quite accessible by using public transport. Have an experience to see the sunset and enjoy local snacks around. Many types of accommodation nearby. It's a popular destination for domestic visitors, although people can't swim in the beach.","","",""
"I would recommend some time in Fort Rotterdam to learn about the history of Makassar and the surrounding region.  WE are grateful for the guidance of Uddin, a Torajan who was obviously passionate about the history of the region.  He brought us into the museum which had a…","Very crowded at night, especially on weekend. The beach is dirty, so many rubbish. There have so many place to eat Pisang Epe.","","",""
"Nothing really exciting, a nice to have sight. Museums are ok but can't compete with national museum in Jakarta.","It is a dynamic spot. Where you can just walk and meet people or buy some Ole Ole (souvenirs ). And perhaps have a pisang pepe (grilled banana) with, if you dare, Durian saus. The best time, I think, to visit is dawn and later. Because it's not that hot anymore. It is also nice…","","",""
"Fort Rotterdam is well preserved, maybe even more than that. The buildings don’t look that old and most of them are still in use with many cars parked in front of them. All together there was not the ‘historic atmosphere’ you should expect. Very negative: the people inside the…","at the beginning, I thought that I will find sandy beach in here, but I was wrong. This place is more to be a city pier and plaza, but in a high-fashioned and artistic with numerous statue of local heroes (bust), statue depicting people playing traditional games, and giant…","","",""
"great historical museum to be visited.It's kinda old place that used to be Netherland's but now become Makassar's that we live by","Nice view especially at sunset, but no real water access, brown disgusting water.. However, you can just take a walk around and enjoy the ocean. Talking about a beach is simply Not correct.","","",""
"walk around check out the museum its ok,interesting yes,entrance is free and a small fee for the museum get there by becak then walk back the hotel around 10 mnts .","Losari beach is one of you must visit in Makassar. The sunset is beautiful from here. If you go here in the afternoon, close to Losari Beach there are lots of people selling snacks.","","",""
"This site is a good reminder of colonial times. It is well preserved, even though the fortress wall is decaying. It is also well maintained as it is kept clean and tidy. The museum provides many information and good education. It used to offer magnificent view over the Bay of…","This is the most one to visit in makassar. Sunset views so awesome. And many food street here. Very recomended..!!!","","",""
"I visited this place with my pupils, there are much historical information here. and i really happy found there are some foreign taught English Language to the children and teenager who wants to learn for free. the area is so wide. good atmosphere, and kind staff. they provided…","nice for take a walk or stroll. nice beach and you can eat and drink. Many Indonesian people want take a picture of you if you are white.i was here in may 2014","","",""
"There was a very loud culinair competition going on when we visited. Spoiled the entire historic atmosphere. I agree that using historical sites is fine to keep them relevant beyond tourism. Just feel unlucky this time it spoiled my visit.","Losari beach is a place for couple to just hang out and spend the evening. It's been like that. The most famous pastry is: pisang epe. It's baked bananas with heavy palm sugar syrup. Sometimes they add Durian on the syrup. Enjoy  ","","",""
"Remembering the impact of Dutch colonization is important in Makassar, both to locals and foreign tourists.  Exhibits are modest; be prepared by having done some online research beforehand and enjoy the old buildings and spaces. Sad to say, it was also used as a prisoner-of-war…","good beach event without sand beach. due to there just a concrete pavement, so the atmosphere is hot enough. it need more plant.","","",""
"Especially interesting for Dutch people. Museums are not related to the fort and don't have valuable collections but it is fun to see the fort from the inside as well. ","the main reason to come to losari beach is not about the beach or picnic but Sunset. so that point really called us to allied with most of local tourist. yet we are not lucky enough.  the cloud perhaps covered the sunset. the beautiful amirul mukminin mosque took us impressed as…","","",""
"From Malang i already plan to visi this fort rotterdam. Guided my rent car and great driver. No ticket entry here, not modern and complete castle. You can see museum from diponegoro history. Souvenir is sale in this fort rotterdam. Just make us understanding about history.","Great place to taste local food and snack, must try pisang epe that sold at losari while watching a very beautifull sunset there. Will be crowd around sunset till night, have a lot of restaurant around there ","","",""
"It was my second time going to Fort Rotterdam. The place is neat and great for taking photos. My sister really enjoyed her time looking at the things at the La Galigo Museum.","it is a good place to take picture, to show your friends you ve been at makasar. It has big letter CITY OF MAKASAR and PANTAI LOSARI. Go there at the sun set, it s a great landscape","","",""
"When you enter fort Rotterdam you are asked to make a donation (amount is free of choice), we found this a bit strange as all locations we visited in Indonesia so far had a standard entrance fee. Insight you see the old building which is quite nice. Also, there are two little…","Well, this definitely a place you where you can hang out, try local street food and do a bit fun by hire a boat to take you around the Losari beach. You can hire a full boat or pay per person. This area normally getting crowded around sunset time and if you walk further up a…","","",""
"The colonial history here is integral to Makassar and its heroes. A visit to teh well maintained museum keeps you engrossed in its origins and developing history. Worth a visit","I think they should revise the name of this place.. because there are no beach in this place.. however this is the most crowded place in the town especially during the sunset. And not far from this place you will find many local restaurant with it's variety. But the sea food is…","","",""
"This is a fort, built during the Dutch colonial in Indonesia, hundred years ago.  The place is still looking good and maintained.  And it is free. A must visit place in Makassar ","It is definitely not a beach. Losari is very crowded during afternoon/sunset. However, I was amazed with the cleanliness of this spot eventhough there are so many people there.","","",""
"Fort Rotterdam is a fort built in Makassar on the island of Sulawesi in Indonesia. It was captured by the Dutch in 1667 and became a center of Dutch colonial power in Sulawesi. Following the Java War (1825–1830), Javanese prince, and now national hero, Diponegoro was imprisoned…","great place to be visited because there are so many street snacks we can buy and also the sunset view during 5 pm.","","",""
"Ok, it's not going to blow you away but it's a nice way to spend an hour.  If you read your guidebook before you go in, you don't really need the services of the overpriced guides who hover around the entrance, nor do you need to pay extra to go inside the 'museum'.  I've never…","The scenic Losari Beach, which is a quite well known tourist destination in Makassar, has a new attraction. Recently, an exquisite mosque, called Amirul Mukminin, has been constructed there. This attractive thee-story mosque is built above the water to present a majestic…","","",""
"A well presented historical site, we went into the museum inside and had a guided tour of the Fort. The guide spoke excellent english, and gave an in depth history of all facets of the fort. well worth the visit.","this beach is good with board losari, toraja. but very hot on the afternoon. while i visited have someone was broadcasting film on there maybe local film. surrounding have shop can buy clothes","","",""
"Like : The Dutch looking beautiful yellow building. Dislike :They shouldn't use the place to do event at the peaceful looking building. Too crowed with locals and hardly have place to move. ","Losari Beach is one of a lot tourist destination in South Sulawesi. the kind of people. delicious Pisang Epe, near with the craft shop, hotel and there are some spot for kids to playing car and so on. but i disappointed with the beach. there much of trash. keep clean for better…","","",""
"i've been in makassar only for couple of hours, so i visited this fort, it was amazing for me, to see this beautiful fort. cuz in jakarta we couldnt find this kind of fort anymore, the place is so strategic along the streets. wish i could go back and visit this fort again","Walked around on Saturday night. Lots of people with young children riding the electric toy cars. Nice to have seen, but not that special for a city this size. I had expected some street artists to entertain the crowds with magic, acrobatixs or some other entertainment.","","",""
"Obviously a well-loved landmark, worth seeing to appreciate the history. I just loved seeing and holding  an Iguana! ","This beach had been revitalized. Now you can walk along the beach or just sitting waiting the sunset. But the beach itself is dirty. Many trashes in the beach. Feel shame about this.  You can easily find merchant whom sell drinks or snacks. Not far there are many cafes and…","","",""
"You can learn some history of South Sulawesi in the museum, only if you speak Indonesian. There are few English descriptions of what you are seeing. If you are not fond of history, don't bother to visit. The buildings are sober and the cleanliness is poor. The weather is very…","I think this beach is common to visit. Because when afternoon its not crowded, in the night it become market called ""pedagang kaki lima""","","",""
"even though this fort is one of the most visited place in Makassar. but actually it is not that good. it has historical value of course, compared to other forts in Indonesia the building is not that good. nonetheless, it has a very large area and nice museum. so, you can learn…","Came here with my partner, coz people suggest to come here. For me, I didn't see anything special. Guess it's popular for the locals for hanging out in the afternoon or evening. ","","",""
"need improvement on the cleanliness. it's actually a historical site, it should be cleaned often. you can take cool pictures from the top part of the fort.","Losari beach is the beach with no sand, it like a dock. But every afternoon a lot of people come to the beach to wait for sunset time.  And a lot of people selling grilled banana and local beverage call sarraba.  The dock no too clean and no other fasilities like toilet. ","","",""
"This place reflects good history but surrounding is not attractive enough for visitors except for nice landscape which is good background for taking photos. Clean museum and surroundings.","1. its not a swimming beach for sure, because this is a port.  2. lots of street seller 3. so far its a safe place for me, i never have any trouble when im there, but its always important to keep our belonging insight.  4. its a place where they held major celebrations like (new…","","",""
"Fort Rotterdam is a very interesting historic site in Makassar City on the island of Sulawesi in Indonesia.  The site is very well laid out and easy to navigate. An interesting museum but quite steep stairs to get to the upper levels. Put aside some time to have a thorough loom…","Best place to be to see the beautiful sun set and take great photos as there are lots of statues and monuments that represents Makassar along the Boulevard. Go during the evenings as that's when the push carts selling local delicacies are there. Plus its not so hot and humid. No…","","",""
"Please make the effort to visit this fort.  This fort is a very fine example of forts of that era I know that it will only take 15 minutes to see the place but it is worth it.  I am saying this as it under visited and it deserves more.","A delightful waterfront. There are big signs giving the name of the place and three parts devoted to the main type of people. Nice big statues to take pictures of on all 3 parts. Big Mosque on the left side very holy","","",""
"The area is not too big and can easily been seen without a guide in ten minutes. With 150.000/person you can attend to both museums and especially the other was an interesting opportunity to update your knowledge regarding to Indonesian cultural heritage and learn more. As…","Do not assume that Losari Beach is similar as Kuta Beach. You can not swim here. But try to visit at night. Lots of food vendor, as well as other vendors who offer you children toy, shirts, and even gemstone.","","",""
"most visitors don't care about cleanliness of the place, trash everywhere, gravity everywhere, ...it was so sad and annoying to see that.","I came at daytime, so there is nothing to see except the landmark ""LOSARI"" words. But at nighttime this place is such a hip place for Makassar youngster, especially, because of the mobile food stalls which came there after dark.","","",""
"We visited Fort Rotterdam on a sunny and hot day. The buildings are sober and not very glamorous, in typical Dutch Protestant style. We paid extra to get into the museum but not much was to be seen there on one side, the opposite site (use the same ticket) was much better.","If u ever come to Makassar then dont forget to spare some time visiting Losari Beach since this is the perfect spot viewing sunset ever.","","",""
"The museum at the fort is very interesting. There are actually two museums, the main museum on the South side and a smaller museum on the North side. Plan on spending an hour or two and make sure to check out the corners of the fort.  ","not so clean, could do better, but overall is okay, its got fantastic view in the afternoon. worth a photo shooting.  ","","",""
"As a foreign visitor I was charged IDR10,000 per entry. Very cheap. The facade of the fort was imposing as seen from outwards. The old and damp wall surrounding the area exudes  its authenticity. However, the seemingly modern buildings (assigned in alphabetical identification)…","Unfortunately, this place falls into the 'rubbish ridden' catagory which is all too common throughout Indonesia.  The shops and restaurants around are ok, but the beach and promonade need desperate attention.","","",""
"A remnant of the dutch colony in Makassar. The museum exhibits is quite interesting. Recommended for photographer as the fort is quite beautiful.","Like: the hawker stall set beside the Beach so you can watch the sunset as you sip your coffee and enjoy Pisang Epe. Dislike : Not really a place for swimming . Too little shopping  places at the place unlike Phuket","","",""
"just a short visit at night when this place hosted a music and culture festival, the site is impressive but no chance to explore further :(","We walked from our hotel to an open air eating venue which we really enjoyed...maybe 1.5 km...the activities on the beachfront made for an interesting walk....lots of family activity, colourful, moving rides for little ones....it is always lovely to have water views and see…","","",""
"A leisurely visit to this place with adequate time to browse through the artefacts and displays in the Galigo Museum will take about 2 hours at least. I went twice, once in Nov 2014 and once in Feb 2015. The museum admission costs a token sum of 5000 rupiah. I learnt the meaning…","we went to lots of beaches before especially in our home country Malaysia and ours are a lot cleaner as in this place we can see so many rubbish floating around","","",""
"The Fort is interesting but there are few english descriptions of what you are seeing.  I was reading wikitravel but that is not enough to understand what you are looking at and how it impacted Makassar over the years.   We found a local guide who spoke very good english.  He…","The place is run down and very crowded. We went for the sunset and it was really nice. People just sat everywhere; on the floor, on top of statues, on about anything. ","","",""
"Nice site, ideal for an afternoon stroll, and quite fun with several local students taking pictures with you and asking to practice their english for a few sentences.","Enjoy beautiful sunset on this iconic landmark of the city. There are many food vendors along the street. You can walk to Jalan Somba Opu to buy some souvenirs.","","",""
"Nice old dutch fort. The two museums in there were not so interesting. It's nice for a short visit. It's a pity you can't get inside the houses, except for the buildings with the museums.","This beach is really mess! Rubish everywhere, in the street and also in the sea.   But you can buy some food called "" Pisang Epe"", so many people selled this nearl Losari Beach","","",""
"Interesting buildings and the air conditioned building provided relief during the hottest time I'd the day","Losari is a good place to spend time waiting for sunset. But feeling so bad coz we can see rubbish everywhere, specially on the water. Need awareness from everyone to make it better.","","",""
"Full of school students but a good overview of the local history and culture. Its a pity only one side of the museum has English comments on the displays. One visit enought to see it all.","just like your ordinary beach, they dont have white sands for sure but you can see the beautiful sunset here, it's s pretty!","","",""
"this place would be nice to those who really love history i guess...nothing interesting,but its free and it was just a short Beca ride from our hotel (Aston),so...since it is in the things to do list in Makassar,we gave it a try..","When you visit Makassar, you should go here. Best time is when sunset. You can enjoy the sunset while you are eating its traditional food, 'pisang epe' or maybe 'pisang ijo'. Please bring your camera also if you don't want to miss beautiful scene.","","",""
"Walked over from our ship in the rain to Fort Rotterdam which was built in 1667 by the Dutch.  There is no charge but you can give a donation.  Worth a visit even though you can't enter most of the buildings.","This is a good place to take pictures specially during sunset time. This is a crowded place where locals hang around. There are also a lot of stalls selling the famous local snack ""pisang epe"" or grilled banana with different flavors for topping. Just a walking distance from our…","","",""
"Liked : Museums, Old buildings, Cultural Attractions, Traditional Art Performances. Disliked : Nothing to be disliked.","Best time to go to LOSARI is in the evening, here is the steps on how you can enjoy LOSARI at it's best;   first you got to enjoy the sunset there, and took a picture at the LOSARI landmark name.  second you got to try to local cuisine that sold by street vendors, which is…","","",""
"With such a rich history, one of the few tourist sites in Makassar is definitely worth a visit. You will be required to pay a 'donation' at the entrance with an additional fee for the museum. Most of the buildings within the precinct cannot be entered and you may be approached…","The beach is not that good (out of my expectation). But there are so many attractive place to take a picture! But the floating Mosque near the beach is awesome!","","",""
"For the shake of history and a bit of knowledge for my son/daughter need to be aware of, I decided to introduce this fort to them, where honestly even me never revisiting this place during my many years of time there, I mean Makassar.  Although almost nothing improve in it, my…","We could run along the beach frontier in the morning because not many people around. However, in the afternoon tables and chairs were set up by the food traders along the assigned area. This drew many gastronomics to have their fills. It is the best place to while away your time…","","",""
"There were not many place to visit at makassar, so we came to the fort at noon. There was Pangeran (Prince) Diponegoro jail, but we can't go in. We visited the museum inside, and they collected entrance fee. Another rooms mostly locked, without any explanation or reason. So we…","This was a good beach in the past, but the glory has worn out as it became the hangout spot for people of all ages. Trashes from all the street food are everywhere. If you like crowded beach, then you may like it. Otherwise, I suggest other beach, Akkarena, around 20 minutes…","","",""
"You may find that at Colombo, Sri Lanka, there's something almost identical to Fort Rotterdam.  If done right, this Fort shall be like the one in Colombo for restoring the structure to its rightful place and housing commercially successful business.  Here, the Fort has been used…","Good Tourist Destination Point. Natural Beach at Capital City Easthern of Indonesia  Onest Famous Traditional Snack Food of Makassar "" Pisang Epe "", and many more. Good trip for you. Nice looking and enjoy the city.","","",""
