"Fort_Rotterdam","Losari","Bonerate","Bantimurung","Bira"
"Fort Rotterdam is a Dutch koloniaal remainder. As you are in Makassar, go and visit it, but do not spend too much time there. Not much to see, and the museum is very ancient. Don't be fooled by the guard who speaks Nederlands. He does indeed, but his information is rather…","The day before my visit, there was a big event in this place, shown by the many publication & decoration still left in the place.  The seawater is green, this is not a swimmable beach.  There are a lot of interesting sculpture & places to sit in this place.  One of the…","","",""
"The complex was okay. The museum is alright too. Only it was not comfort, as I sweated all the time. The airconditioning inside the museum was not cold at all. It is a pity, as the content of the museum could be more enjoyable if they put  a good airconditioning. And it will be…","Walked here late at night and had some great street food. Lots of food stalls and friendly locals to sit and chat with. ","","",""
"The location of this prop near beach area..I suggest you come here at the afternoon, not too hot...great light for take picture...you can feel the ambience of good old fort when you walk around the area. If you know about prince Diponegoro, you can feel his sorrow...his…","Do not think it is a beach with sand. It is not It is reclamation for the extention engulf the existing land. While you are in Makassar if you have really nothing to do, you can come here for sunset picture.","","",""
"The Fort is a legacy from the Dutch colonial era, rich with history.  Free entrance, you only need to put in your name in the guest list.  There is toilet available, with acceptable cleanliness.   Outside in the parking lot, there are some hawkers that sells cold drinks, there…","In late August, anyway, only a few people are on the waterfront during the day, and visitors are soon surrounded by drivers offering to take them somewhere for a fee. But starting around 4:30, it starts becoming the place to be and be seen. More and more people gather and stroll…","","",""
"Nice fort with a nice slice of Dutch history. The fort is very well maintained and is full of local tourists (who are very willing to take pictures with you if you are a foreigner). ","Nice place to meet friends, to walk, to take pictures, to admire the view with ships, to see some statues.","","",""
"Stop in at the guard booth, they'll ask for a donation, but be aware that the museum also requires a ticket. The museum has some very nice artifacts. Part of it is well presented and explained in English although poorly lit, part isn't especially good, but it's all at least…","Well this place was really good I few years ago but now so much crowded even Sunday the main road has to be closed so people's can enjoying their morning ","","",""
"There were several aspiring English learners who gave us a tour and some helpful info about South Sulawesi. It was really enjoyable talking to some locals.  Also, it's near some really delicious food.","Firstly, this isn't really a beach at all but rather a promenade along the waterway. Secondly, it's fairly dirty and not in the best condition. I really don't see the appeal. Not really worth a visit at all.","","",""
"We visited Fort Rotterdam but it was not something interesting or in a beautiful location. Some buildings are used for cultural purposes.","The beach with no sand. The most interesting place in this beach is the ""Losari Beach"" icon that is placed in the middle of the deck. Many people come to this beach only to be photograph in front of the icon. Near the beach, you can find snack cafe that selling traditional food…","","",""
"Impressed with the structure of course. Still strong and still having the touch of the colonizations. However, the museum has nothing much to be seen. practically not spending much time here but worth a piece or two pictures here. ","We went along in the evening, if there was a beach we missed it as the promenade is absolutely packed with people, stalls and performers. A nice way to spend a few hours watching street dancers or whoever pops up, sample some of the street food. I also got interviewed (?) by…","","",""
"The area of Fort Rotterdam is quite big, but only 2 buildings (museum) that we can actually visit (enter). In 1 of them, not too much to see, but in the other museum, some items are quite good. It was heavily raining at that time, so I spent hours there... and it was ok.","It is actually not a beach. So don't expect to bathe here. It's more like a port. The seafront is lined with statues and artworks. People will gather here during sunset, sitting, taking pictures, eating pisang epe (grilled banana, pressed, topped with chocolate…","","",""
"Area is not really big.. building and ambient not really fascinating but it's full of story and history.  Not many photos displayed but lots of paintings showing the phenomenon and pictures the moments and historical persons during the Dutch colonial. Entry is free.. ","Losari beach is a nice place,but because some people that don't have a responsible attitude, they throw away garbage as they wish, it make sting smells..","","",""
"This is one of the few remnants of Dutch history remaining in Makassar. It's in reasonably good condition and seems to be a popular place with locals on the weekend. There's not really too much to see, and a quick walk around is sufficient. The museum is nothing too special…","It was a bit crowded on the weekend we were there, but so many things to see! Found a spot to sit down as the sun began to set and caught a beautiful sunset :)","","",""
"This place is the old heritage building. Long time ago, the name was fort in Ujung Pandang (the city name before it changed to Makassar). Located near the Losari Beach and seaport, this place is easy to get. Clean and quite. Note: you need to pay the retribution in the counter…","On nights where there's live entertainment , it becomes a crowded and fun place to be! Otherwise, the place is pretty slow. It does have local food and a ""nice"" one kilometer walk from the floating mosque up to the northern part, with good restaurants just on the other side of…","","",""
"I payed a student guide 100000idr and he knew alot about the place so i thought it was interesting walking around the museums. A little too many daggers on display though. After a while not super interesting. ","It used to be well known beach with the sign ""Pantai Losari"". It was corrupted with plastic bottles, smelly seas, dog's stool, and the view also messed up with the reclamation land. But still it was crowded with local people who enjoyed their time having dinner with their…","","",""
"The place is closed to the beach and police office..the place is unique but dirty and still under construction at that time..the rest room is dirty and poor..","It has lots of statue, which is good and attractive for tourists. But i can't stand the smell, and it's kinda dirty.","","",""
"Visited this fort in the middle of my business trip, I was quite intrigued about this fort especially after reading and seeing some photos shown here. So off I went. Upon arrival at the main gate, I was guided to the small guard office where they asked me to fill in the guest…","Great park, great view, many food outlets, crowded people and more. Here in March, transit for next city. But still good. Great for a day or two but seriously bit dirty. Shops were across and people walk through the street with vehicles traffic carelessly.","","",""
"OK, the security guard at the entrance asked for ""a donation"", then we arrive at the museum entrance and have to buy a ticket.  A foreigners ticket is twice the price of a local ticket, but I understand that locals should be encouraged to visit.  However, if you are changing…","The beach is actually a promenade by the sea.  Public spaces for all people. One of the beat time to come is around 5pm. People watching and waiting for that beautiful sunset.  ","","",""
"Free to enter. Museums are 20,000 to enter. One ticket for both museums.  No sign posts or information to explain function of fort or individual buildings. Museums are ok, good info about the history of area and people but not the fort. Busy with locals (visited on a Sunday). We…","I would say this beach is way turn off to me, polluted by the people. Rubbish everywhere. It is not what we expect at first place.","","",""
"Actually not so many things in this museum but you can have an info for tribes in south celebes like Toraja and Bugis","We took a stroll on this walled beach front in the morning, where many people were doing their morning exercise like jogging. In the afternoon and evening this place is crowded.","","",""
"This fort is an old fort which reminds on the Dutch Colonial settlement in Makassar. However, there are lots of places / corners around this Fort Rotterdam that you can shoot a nice instagram photo!","Losari beach getting better day by day.. now, cleaner, more beautifull view, and have lots place for parking.","","",""
"We went there on the recommendation of or there users which said: a place to visit. I will be very short and just say that it is not a must to visit. It's an old fort from the Dutch when they colonised Indonesia. The buildings are not kept in good conditions and al around you…","Your visit to Makassar is not complete without enjoying Makassar Strait view from Losari Beach. Best time to go is to catch sunset while enjoy your Pisang Epe. Saturday night will be crowded than usual because there will be a gig there. Free parking for motorcycle, but I don't…","","",""
"Benteng  (=fort) Rotterdam is a dutch fort from the 17th century. It had been well restored and is now very much worth visiting. First, make a walk around the complex on the walls; next visit the musea. The explanatory signs are mostly also in English. It really is really well…","last time I was here there is a festival on the beach so it is very crowd. from now on at night the build a lot of food stall . drink and food are served well here","","",""
"The most important Dutch colonial legacy in Celebes is perhaps the Fort Rotterdam. It is worth to have a quick look to the colonial building located very close to the Paotere harbor and the Losari Beach. The Sultan Hassanuddin statue stands in front of the entrance gate. In some…","I always love to come to Losari Beach. Nice sea view, comfortable marine walks, floating mosque, popular cheap food sold in food stalls, gay atmosphere, Losari Beach is a perfect place to spend for every one.","","",""
"Good Museum for Netherland's History in Makassar including Museum of Galigo in one location, it is located in front of Port of Makassar at Jalan Ujung Pandang.","The beach is not has sand and point for swimming spot. There is a permanent concrete wall along the beach side to prevent the sea water going to the road. The good time to come to the beach is in afternoon or at night to avoid the hot weather condition.","","",""
"I suppose I was expecting a real fort & this was more like a large monastery with a church in the middle of a huge quadrangle with covered walks.  The only evidence of the old 16th century fort was the outer walls & it was possible to walk on a small part of the ramparts. The…","It's a long line of beach that is crowded by the people in the evening especially on Saturday night. It's a good place to walk in the morning or evening. Since the area is crowded, beware of the pickpocket","","",""
"The complex houses a museum about South Sulawesi, the traditional weapons as well as La Galigo an epic of Bugis. The colonial complex is huge and it is good for photo shoots. Outside the complex you can find many street food vendors.","Pantai Losari is all about the promenade. There's no beach to sit on as such. Every time I came here to stroll along the promenade or sit down to get some sun I was asked for a photo. The ladies were very polite about it, so I never refused, and they were very excited to have…","","",""
"Makassar is not a tourist destination and seems to operate in a very relaxed manner. We made the effort to go down to the old fort and enjoyed seeing the fort (which is quite large). There is a small museum that had a selection (if not basic) of old pieces (manly swords). It is…","This is not really a beach in the classical sense.  Most of the area has been reclaimed.  It is still worth a visit as the place is very popular among the locals.  So it is a good place for people watching.  The beach comes to live in the afternoon when most of the foodstalls…","","",""
"I like itu the interior, the design ia very unique , the place was a history place in Makassar, inside of the Fort you can see many things about Makassar, the goverment have a good Maintenance foto this building.","The beach was fine, it is where you get to meet and experience the lives of local in Makassar. However, the word statue are vandalized and not well maintain. Shame!","","",""
"The fort itself wasn't that interesting in my opinion but it was nice to see. You make a ""donation"" when you enter the fort but really it can be anything - we only had 1600 RP (and big notes) and they gladly accepted that. What we'd recommend is to visit the museum(s) inside the…","When you ask people about where to go in Makassar, it must be Pantai Losari. The government recently renovate the beach and make it more comfortable to stroll around. the sunset is best to see from one of the restaurant nearby. ","","",""
"This is a good start to know parts of Indonesian history.  Makassar was one of the first cities/places to fall into the Dutch hands.  The fort has been restored and maintained quite well.  However, they could do more on the cleanliness.  The explanation on the displays could be…","Easy to access, good to visit with friends and family. Must try to eat PISANG EPEK (roast banana with topping) and Saraba <U+0001F44C><U+0001F3FB>","","",""
"It has historic written all over of course,i t is a good place to go see history and kill time until it's time for your special affair of the day. You should include other places to visit on the same day because it won't keep you busy all day.","well developed & maintained but not much to do/ see here, get your self a good selfie in front of those gigantic letters and scram immediately. Avoid the persistent boat vendors offering a boat ride, the sea is dirty and smelly within that bay. ","","",""
"Nothing more than what you can see on the pictures. At entrance they ask for a donation, save that money if you want to entrance the museum. Do yourself a favor and just skip it.","Dont expect sand and wave, beach is not swimable, just for the view (which is not much) You can take a boat ride to the open ocean though. Lots of street vendor at night, the coffee is good and try the local delicacy (pisang epe) basically grilled banana with whatever topping u…","","",""
"Spend the whole afternoon in Fort Rotterdam. The entrance fee is by donation - 5k rupiah would do. Quite a nice place to take photo! Well maintain but cleanliness, not so?","This is the heart of Makassar. The most popular hangout, where to find local foods such as Pisang Epe'.","","",""
"The place has a lot of potential to be expanded. It has a good number of collections from Makassar ancestors. Unfortunately they were not well taken care of. ","Losari Beach is packed with families and attractions, people busking , life size movie characters and many shops and dining options all over. Great for a few photos especially around sunrise or sunset as it captures the light in a magnificent way","","",""
"Turtley shaped fort designed to sustain artillery attack back on its day. Impressed by the stone work, I believe those walls at least are 1 meter thick. Explore around and get to know the colonialism back on those day.  Masuk gerbang terus ngisi buku tamu, bapak petugas berbaju…","The beach was replaced by a sea wall many years ago to avoid erosion. It was never a place for swimming in any case as there was, and unfortunately still is, a lot of garbage in the water. In the evening the only real drawback is the heavy traffic on Jl. Penghibur.  Visit in the…","","",""
"One of indonesian historical heritage. We saw 2 mummy collection here, creepy but awesome. A wide area and many collection <U+0001F44C><U+0001F3FB>","Though it is called Losari Beach... Don't expect a beach as there is non..... A stretch of coastal line, not very long if compared  to Patong Beach or Karon Beach in Phuket, Thailand","","",""
"Fort Rotterdam only a 7 minutes walking distance from hotel, near the famous pantai losari with ancient portuguise design if I'm not mistaken, with underground jail below the fort itself surrounded with several big room and greenery garden inside  ","Wonderful place to enjoy sunset, so many stalls selling 'pisang epe and saraba' ( grilled banana with topping of your choice and drinks that consist from ginger water, palm sugar plus milk) the local's favorite snacks.. Love to take a snap here and there, because they have…","","",""
"Fort Rotterdam is in the shape of a turtle from an arial view. Sufficient parking out the front.  Unfortunately in need of much repair/ care. But nice for a quick walk around the walls of the fort. ","Cool spot for sunset. Heading the west coast of Sulawesi. You can easily find local street food (pisang epek) here. But, disappointingly, it's a bit far from clean.","","",""
"This is a nice surprise for those who treasures the value of history. To place the information within the Dutch colonial fort is a very nice touch.   The fort is quite well maintained, the information presented concise. However, we feel that there are a lot of wasted space, plus…","This is not the best place for recreation in Makassar but it just the trademark of Makassar city. There are many attraction available in many times especially on the wekend. Cool enough to be visited","","",""
"Surprisingly amaze with former holland soldier stronghold in Makassar.  Amazed on how holland soldier built this stronghold so complex with their necessity. Including their necessity to imprisoned Indonesia people. Eventhough amazed on how Indonesian people suffer from…","When we go to this beach, there will be an event in the night, so this beach full of preparation for the event.  Walking from ""Bugis"" to ""Losari"" and any other spot, is good enough for you who likes to take picture. This beach is instagramable <U+0001F4F7><U+0001F605>. Many unique photo spot in…","","",""
"Dutch colonial fort pretty well maintained... Though there is no entrance fee but upon signing in guest book, Visitors are asked to make 'Donation"" but no receipt issued....","Especially in the weekends it's nice to see the locals enjoy themselves with food, music and markets.","","",""
"Good for people who like national independent history and a lot memorials with nice ocean view and specially for Japang and Hollander","Maybe its nice to take picture there (if you need proof that you've visited Makassar), but nothing really special here. You would've drive by this area anyway if you're in Makassar. ","","",""
"No need to pay to enter this historical building. If we need local guides, will be charged by 100.000 IDR at the end of our visit. Local guides will accompany us walk throug the museum and tell the story of every side on this building. Wonderful visit! Got much knowledge there. ","It is a beach with no sand:) so do not expect to swim... It is a pier with many locals or tourists watching sunset. Also there are many restaurants around.   This place keep improving from time to time. I can say this because my grandma's place is located nearby this beach. So I…","","",""
"I was come to old fort since i work in some islands in mollucas area. I visit aome town and every town has small fort.   This Rotterdam is bigger than any fort i have visited in years..","Despite the beautiful view posted on the internet, the reality is quite different. It is indeed bautiful during sunset.  And be very careful when taking photos of PANTAI LOSARI and CITY OF MAKASSSAR. Certain position or view will show some ""funny/dirty"" words.","","",""
"It was a nice, historical building at the heart of Makassar. But the museum inside the bulding was so hot and not well air conditioned. You could spend about 45mins - 1hour in this building and that would be enough. ","Food all the way and street at the night time. Traditional ginger beverages, very good for body. Nice place to hang out with friends with a minimum budget. Also they have art painting museum. A hand made painting from student or local artist was showing in a 18sqm small…","","",""
"Visited the Fort to take photos. It is best to visit either in the morning between 10am to 11am or late afternoon just before sunset (4.40pm to 5.30pm). It is quiet a great place but not all 'spots' were open to be entered due to renovation and other 'not being explained or…","This is the most famous city landmark of Makassar. The best spot is taking picture with background big letter of PANTAI LOSARI. But when I visited it, there were some umbrella tents that sell food in front of the letter. The management should consider not to give permit again…","","",""
"It said free entry but the officer asked visitors to fill in the visitor book inside the office so that we were pushed to give extra money. Not big but it was just improper....pungli","good place to enjoy the time, specialy on sunday it's car free day and the children can play with no worries.","","",""
"There is many colection related to the war in Dutch era. The fort are is very big and located in front of the beach. You can catch the sunset view from the top if the port and it's really interested ","Good view, there are many people who sell the traditional food as pisang epek. Many souvenirs store here But there are some people who throw the rubbish . The government should take some policy and action for this matter.","","",""
"Too many people like a lovebirds and only want to take selfies than to know about historical and story behind this building. ","Picturesque and interesting and can meet very nice and very friendly people .Very Good. I met Indonesians  Chinese  Japanese holidaying we met did not speak each others language but could communicate and all had a great time together  I will always remember.","","",""
"It is free to enter. They ask for a donation fee to enter. A very historic place left by the Dutch. However, I felt that the items displayed in the museum inside are not well taken care of. You can see them deteriorating. Such a waste.","If you think, that Losari Beach has sandy beach, you're not even close! It's a square, practically it's an open space area with sea view.  A tip from local: - If you want to take a good picture without anyone wandering behind you, do it in the morning. It's quiet and no tourist…","","",""
"What do you expect? This place save many history of indonesia when netherland come and build this place.this place is near from beach and port to kahyangan island.i not really reccomended for a big expectation because this place not really organized by government","The beach is good for hangout or even meeting, there are many traditional culinary spot here, restaurant, cafe or just coffee bar also many attraction and people visit while on the weekend","","",""
"My expectations were well surpassed. The museum collection is very good and helps explain the long history of the area, beyond only the Dutch colonial period. A fee artifacts are exceptional, including those in the photo I'm attaching. Well worth the visit! ","losari beach is a nice place. we can enjoy the sound of the waves, while walking along the beach, and also enjoying culinary ""pisang epe"". I was impressed the beautiful sunset on losari beach.","","",""
"Fort Rotterdam is the best-preserved piece of Dutch colonial architecture in Makassar, and indeed on the whole island of Sulawesi. The buildings are in good condition and the grounds more or less well-maintained. There is not a lot to see here per se, but in a city of few green…","The most iconic or landmark of Makassar city is Losari Beach. Easy to get, and very crowded especially on Sunday evening. You can enjoy the sunset, and try local foods pisang epe, mie goreng (fried noodle), nasi goreng (fried rice), and many more.","","",""
"A lesson in history of how Makassar started and became the great trading port it is now . The native rulers . The structure and civilengineering fete  that became a fort and how things progressed to today","I come to this beach at Sunday Morning. Initially I intend to work out a run in Losari beach area. However I found Losari beach is very crowded with people and merchants, so I undo my intention to work out there.","","",""
"There are some nice aspects of Fort Rotterdam: it's easily accessible, enjoyable to walk around, and educational. The museum would benefit from some better explanations of the exhibits in Bahasa Indonesia and English and it would be helpful to have guides that didn't pressure…","This place of central crowd fir this city. You can look alphabet of all tribe in sulawesi. So many local traditional food such as pisang epe, mie titi, etc","","",""
"Must need a guide for the museum. Otherwise just walk around and you are finished in half hour.  The first museum contains lots of information and it can last one hour. The second one only show some weapons and you can finish in 10 minutes. Not worth the 5,000 rupiahs.","This is the right place to knowing Makassar history. Inside Fort Rotterdam have La Galligo museum and library. Also, Pangeran Diponegoro (Indonesia National Hero) cemetary.","","",""
