"Fort_Rotterdam","Losari","Bonerate","Bantimurung","Bira"
"It's a Dutch colonial fortress and still well maintain. A good example for good fortress architecture, they have a museum as well. I think, cleanliness could be more properly done  ","Losari beach provides us with many cullinaire things but the food streets are not good. If you want to eat and taste the makassar cullinaire, you should go to the restaurants around the beach. The pedestrian side walk's not good to walk around, i think there's no pedestrian…","","At the front gate we see the butterfly shape gate were really broken, means this park condition need maintenance.  But the view inside was very amazing, with beautiful butterflies and we also can climb up to the bridge to see butterfly with great view.   Inside park we can found…","I was dissapointed. This beach is so popular so my family decided to watched the sunset there. By the time we entered the welcome gate, it didnt looks good, it was so packed, also full of dirt. The same things happened at the beach. I enjoyed nothing there."
"places to visit, parts of colonial history, places to go not far from hotels and interesting places to take photos","The place is dirty and the water smells bad. You can find cheap eat nearby but I would not recommend you to stay more than an hour. ","","Cozy,fresh air,peacefull is atmosfer when visit to Maros Bantimurung Waterfall.Many colorfull butterfly fly around us near river bantimurung.Use sandal if go there because the road was slippery.","Much as people say its dirty horrible or sorts, it has turquoise waters when high tide and powdery white sand."
"Visited on a hot afternoon, and had a guide bring us around briefly. There is potential for this space to be developed further to encourage tourism to the area! Quite interesting to know of the various spaces, and we had the chance to visit a local artist who paints using clay.…","Good enough beach. We just can take picture here, not like ussuall beach. There is no sand to sit. At night some of attraction from local people you can enjoy.  Beside the beach, lot of seller there, you may buy souvenir or local food. I suggest you to try ""pisang epe"" a…","","They claimed as one of the biggest butterfly national park in the world with very rare of kind and also the only one park exist in the world. a lots of interest places inside of National Park such as a lots of cave, waterfalls, forest, camp areas and all nature activities.","White sand and blue ocean with seaviews to the other isle nearby. It is hot during daytime so take your walk before 10 AM or after 5 PM. "
"One of the colonial fort that still exist, keep lots of history. It has museum in it, need more maintenance and more interactive media and activities to turn on the aura of this place","Practically, you don't find anything interesting if you come here at noon. The place will be so hot and humid. But things change when you come here in the evening. The place is so crowded with people enjoying sunset and many food vendor open their stall at night. You can buy and…","","I was guided by a souvenir seller who was very kind and informative, the weather was good, not raining nor too hot, but there were not so many butterflies on the time I came. The guide said that you will find more butterflies in the dry season, especially when you wear red. But…","This is a very nice beach with a view which is incredible.  It is also possible to take a boat to go to the island.  Nice place to relax and to picnic.  There are also little shops were you can buy drinks an small snacks."
"Such a wonderful place to visit and understand more about the history and Indonesia's heroes. Lovely museum upstairs to walk around in as well.","Losari Beach is a bit of a misnomer, there is no beach. This is an esplanade that runs along the sea from the mosque for at least a kilometer. There are numerous statues placed around the promenade and sights across the water to photograph during the day. At night the stalls…","","Bantumurung has its icon: butterfly and yes, there's a plenty butterfly there. Karst hills are awesome!","It was a long 5 to 6 hours over crowded car ride from Makasar, Sulawesi but I thought it was worth it if you want a good beach and great diving What you can do if you don't dive: Go to the beach (see below) for swimming and snorkeling, visit a traditional ship building factory,…"
"When I was there, they were celebrating a huge collection of traditional knives and swords. Got to meet the Minister(?) of Tourism for the province. ","For me it's just a square. There is no sand so how can it be called a beach? It's a nice place for taking some nice photos and that's it. Water is very dirty and is also full or rubbish.","","Poorly managed. Old people tell me it was a beautiful place long ago. Cant find any butterflies now. About an hour ride from Makassr city.","Tanjung Bira takes 5 hours by car from Makassar city. The view is amazing. White sandy beach with the gradation of the blue sea. You can rent a boat to Liukang island and Kambing island for snorkeling."
"Well, there is not much to visit in Makassar so you'll probably visit this one. Not that much interesting and they'll ask for a ""donation"" before entering.  If you're not sure you want to come in, pass your turn and save your money.","Excellent beach in the makasar city.  Losari beach in makasar.  With yg friends trip     Picture at Losari beach. ","","Visiting this place with my husband and daughter. It takes an hour to reach the place. To enter the place you must pay 25k rupiah for the ticket. In there you can see waterfalls and caves. We try to go to one cave it's called Goa Batu.. You must climb for about 150 stairs and…","Visited here with my kid during May, it was quite nice experience. The beach itself is really stunning with blue ocean and white sand. But the shore is very dirty and there are too many food stall that ruins the view. You have to walk quite far to find the best part of Tg. Bira."
"I suggest to visit because you will know all the information inside, ask local guide ( chargeable ) but worth.  Never regrets about this historical place.","We came here bit too late. Is already 6pm. Nice view taking photo. Along the beach lots of local food stores,  local food like pisang keju. Not bad can try. ","","The first time visit and feel awesome.... to sad I can't swim... the water falls so cold and chalenging. Next time visit should bring the swim suit","Blue ocean! Tanjung bira is a great place to escape from the hectic outside. But if you want to have a better holiday, don't stay in bira, instead take a boat to liukang loe island, and pleasee!!! Stay there...! A hidden paradise!"
"Didn’t have a tour guide, because I went with school, the local explained the history to me. Very rich in history, after hearing tempted to read up more about this fort.  Negative: 1) female toilet is locked, waited very long thinking that there is someone inside. 2) toilet very…","We really liked Pantai Losari. You're 'meant' to be there at sunset and eat pisang epe (flat banana with your choice of sauce) - and it's easy to see why. It's just beautiful. Going in the middle if the day isn't recommended - barely any shade and it's really glarey. Good things…","","There is not much on Internet about hotels or local stays (wismas) in Bantimurung nature Parc. But actually there are! The Wisma Bantimurung just outside the parc gates does simple rooms for 200,000 Rp., while the Hotel Bantimurung within the parc's grounds is having newly…","Ohhh yeahhh...  Pantai Tanjung Bira or we used to know as a Bira Beach...  i love this place,. has a beautiful white sands and its like a flour..  The ocean water is so bluee and so shinny...  nice place for a dive and do snorkeling activity.. many guest houses and hotel with a…"
"This is my favorite place to visit in almost every weekend. I will tell you what you can do in this place. 1. You can enjoy the sunset on the fort. So, come in the afternoon. 2. It has Museum contains Sulawesi arts and history, especially Kingdom of Gowa. 3. You can join the…","It's not a beach actually as it's all dammed. But yeah it has one of the best sunset. Just check some pictures.   Note: at night there are some hawker stall selling banana. Many many of them!!!","","This location in good national park...great butterfly,nice waterfall but it's too crowded in the weekend so we cannot enjoy it...","After 4 months ago i was here and today i am back here. Enjoy the sun shine reflecting blue ray on the sea. Easy for to reach this place, 4 hours from Makassar city. "
"Not much to see and no explanation of function of different buildings. However,well-maintained and no entrance fee (you are asked to make a donation). We went on a Sunday and it was wonderful to be allowed insight to how adults/children engage in leisure activities, attend…","Losari Beach is not a beach per se. There is no sand no beach to speak of. More like a stone walled bay. Try taking the boat to nearby islands instead for some authentic beaches.","","This the great and amazing nature of Celebes. butterfly, spring water and other can make you feel peace and you will love it.","Beautiful beach with white sand. U can see the ferriage Port with the beautiful view. This Place Connect Celebes Island with Selayar Island"
"Other then local masjid, the place I’ve always visited when I travel is the historical place and museums; and this place is an interesting place I’ve ever visited; I believe the original version must be more interesting than the “modern” version as I feel like this place has…","For me, a beach should be 'made' of sand, on which you could sit/lay/relax. This beach is made of concrete. It's more like a concrete walk along the sea. At evening, there are loads of people, so gotta be aware of pickpocketting... Many food stalls, some clothing stalls, street…","","Actually, the entrance shows the decay of the park. It has been a long time since there was any maintenance and the same goes for cleaning. The park is dirty, with garbage everywhere.  No effort is made to hide the decay, and no effort is made to attract tourists. On the…","Whoaa, just how disappointed I was, when arrived at the beach. It was dirty, full of crowd (who I bet would make the beach even dirtier!). I felt it's not worth for our 4 hours drive from Makassar. The beach is definitely over-advertised and unmaintained.  The only reason why I…"
"A nice place to meet Indonesian and see how it looks a fort build by Netherlands   But nothing to miss if you do not visit","If you come to Makassar , you should visit losari beach, especially at nite, you can found many Makassar street food, such as poising eppe, sara'ba etc. you can also watch futsal game above the beach.. yeah they played futsal surround with cage to protect the ball so they can…","","I went there to see  the famous wild butterfly although I was told that it was not the best time to do so. However I heard that nowadays it is difficult to see them. It was raining very hard when we got there. We suddenly gave up our expectation and decided to make the best use…","This place is filled with History of the Old Bugis Sailors from Indonesia. Visit the several places which make the Phinisi Boats so famous from the Bugis Culture. These guys raomed the Seas as either Merchants or "" Badjak Laut "" Pirates, thier name spread fear amonst the sailors…"
"This bastion is well maintained, and still in good condition. No entrance ticket. But when i visit this place around 5pm, the place was polluted with smoke coming from somebody burning trash outside. The smoke very disturbing.","I think the beach can be considered as one of the main tourism spots in the city. It is clean, you can find many food hawkers around the beach selling good local cuisine. It is recommended to visit during sunset and take some photographs.","","not so many butterfly that I could find when I was here since it's after raining when I arrived, but you can see the huge waterfall, and enjoy the water below, it's nice to have a walk and feel the breeze at this place :)","I think bira itself  has clear water and very blue sorta turqoise which will spoil your sighy. Its nice to look from far away. As we got closer. It is not a beach where you can lay down in your bikini while reading your book (i was there during holiday season) the beach is full…"
"Interesting but I expect to see and learn more. Tried to hire a local guide inside the compound, his price was RP.100.000, We tried to bargain to no to avail. (Which actually annoyed me, bus he kept saying it only costs 1 euro) Thus, we walked around ourselves. Eventually bought…","Losari Beach is one of icon of Makassar city. So everyone who will visit Makassar, don't forget to visit this beach","","Since we visited Bantimurung waterfall in the rainy season, so the water was a little bit muddy and brownish. It flowed fast and swift, none could approach it closely. We can find about 200s species of butterflies there. There are Butterfly specimens for sale outside of the…","Best: white sandy beach + turquoise clear water, pristine and serene nature, the area is quiet and great for honeymooners or people who look for tranquility and calmness.  Minus: if you're used to the great hospitality in Bali, do not expect to get one in Bira. I hope in a few…"
"old dutch fortress, inside have a museum, my visit was in sunday and museum was closed, it's OK for few photos in this big city without many turistic atractions","Losari Beach is a good place to sit around. It has a clear sky. Nice and beautiful. Since the wheather is very hot. It is recommended to go there in the evening. Lots of food around. Interesting.","","Nature waterfalls surrounded by beautiful nature, however further designed by 'proffessional' from unknown which makes it super ugly. Entree price  Local: Rp.25.000,- Foreigner Rp. 225.000,- (€15) Do not waste your time to visit this ugly park.  You better head to Rammang2 to…","This is a beach in a tropical island with white sand and blue ocean, this beach is no less than bali  "
"The Fort is a historical landmark and a reminder of the Dutch influence in Indonesia's history. It is easy to get to by Grab or on foot. There is an office to the left just past the main entrance where you are asked to sign in and I wasn't even asked for a donation. A person…","I think this beach is good for watching sunset or sunrise. But in the daylight it is so hot and there's no food stall.","","Nice place to relax for the family on the weekend. But need much improvement such as cleanliness, extra attention to basic facilities (toilet, garbage bin, etc), safety and security (some areas are slippey). Local goverment need to show their responsible since this place is an…","Bira is probably one of the most beautiful beaches I have seen but a plague from underdevelopment absolutely destroys the attraction. Overcrowded place full of trash all over. You cannot walk around the beach without seeing TONS of plastic bottles, cups, containers, shoes and…"
"Very nice historic place. Admission free, they ask however for a donation, which seems fair.The on site museum is mildly interesting but does not add a lot to the experience. The fort is a must see in a city without a lot of historic buildings. ","This isn’t an actual beach with sand but a big waterfront area with loads of food stalls, statues and sculptures and people!  Everyone was super friendly and nice. We didn’t eat any food (because I was too worried about getting sick) but we walked along, talked to people and had…","","Good to explore a nature in this park, a lot butterfly fly infront of you directly. A lot of species of butterfly coming to this place to the Bantimurung National Park. Good waterfall with clear water already will make you fresh at inside this national park","Why i called this place as a clear and clean beach? It is because the clean air and the sky is so clear. Tanjung Bira is too crowded when i visited there, so i walked from tanjung bira goes to bara beach. Bara beach is not far away from Bira. It is more peacefully, because no…"
"It's a nice place for learning a bit more about Indonesian (and not only) culture. Perhaps, it needs a bit more maintenance but overall my family and I enjoyed it.","after a few hours meeting at hotel near the beach, we are going to the losari later on for relaxing...  nice beach near the central of makassar city... it was good place for relaxing...","","It was an interesting experience, the day we went it was pouring ran so the waterfall was abundant.  The butterfly museum show cases lots of colour and wonderful butterflies however they were all dead and pinned down in glass case.  I enjoyed our few hours here  ","the  tanjung bira beach is too crowd to enjoy, just go by boat or walking to another spot like bara beach or snorkling to kambing island to have a peacefull place and beautiful view "
"The premise on the whole is historical, beautiful (in its own way), untouched and definitely authentic. Authenticity is a prized virtue! More efforts could be poured into enhancing the interiors to bring out its true charm and beauty. As a history buff, I enjoyed the slow walk…","Nice place , i try to eating pisang epek so really yummyy mix with milo ice and then next time i will back soon to makassar again","","The park is located 45 mins from Makassar. It is famous for its butterfly. But I found no butterfly except in one small area at the end of the walking path.   Nevertheless, I decided to go to the deepest cave there, which was Gua Mimpi or ""dream cave"". It was 1-1,5 km deep and…","The white powdery sands and the three-tiered color beach... I love it! One of the most breathtaking beach i've ever been to. And i want to go back there again! However, there are a lot of garbage in the beach that makes it less beautiful."
"The buildings look beautiful but there is not much else to do. A good information book or guide can help a lot. We liked it anyway.","Arrived here at saturday night... there is a food carnival. Im very lucky in my short visit here, many food stall at that night selling local food such pisang ijo , coto and many more. If you're come to makassar try the local dish & its very delicious. Losari Beach well known as…","","After 50 km from Makassar we have reconed the price for tourist has been recently increased from 50k IDR to 225k IDR. Not only that this area is not worth that much money neither butterflies nor monkeys were available. Well, the only monkeys were the tourist having payed the…","white powder sands ""I love it"", beautiful sunset, clear water to many garbage (luckily not on the beach)  - people should really care about that."
"Fort Rotterdam, full with history,  at first the building started as fort of Sultan Hasanuddin, then became the Portuguese, at last fort Rotterdam since Dutch time in Indoensia around 350 years. Now as museum, and from fort Rotterdam you can see the beutiful view  of Losari…","Beach is more for walking, no wave and no sand. Many stall ""pisang eppe"" and other food. Have live music on weekend.","","Many person spent their weekend with family and friends. Jogging, talking each other, camping, etc. In this park you can enjoy more activity here just like camping, jogging, playing card, or bathing under beautiful waterfall.  Its about 2 hours from Makassar city, in Maros.","This beach still become my favorite ever. I looooveee the beautiful stunning view, the very clear water, the fish <U+0001F420> everywhere, the food they served, the sand that was likely baby powder. And of my besties that stay with me. Unfortunately when I went there, the waves was very…"
"The fort is definitely worth seeing if you're interested in history. It's hundreds of years old, but still in really good shape. There is a museum inside, but the price for expats is more than for Indonesian residents (which annoys me!). You can also be asked for money on the…","It's more a promenade than a real beach. Always plenty of people walking around or showing animals like big snakes or lizards for photo. It's a big part of the city and worth a visit but nothing too interesting.","","After an hour's drive out of Makassar with Indonesian friends, we could hardly back out of going into the park, but had we been on our own, we would have. Rates to go into this poorly-kept, not-very-interesting attraction have gone up to 25,000 Rp. for Indonesians and 255,000…","When i visit Bira, it was already noon, because i was late departed from Bulukumba. Arrived at 5 pm, still got the sun a little bit and waiting for sunset. Thanks God , the weather was good. After visiting the beach,i was ate at local restaurant for sea food. The price was…"
"Fort Rotterdam is a very interesting place to see with a history back to the Portuguese & Dutch occupations. There is also information about the local Bugis & Gowan etc people... worth a visit.","Won't call this a beach. More of a gathering space for Makassar folks, especially during the evenings and weekends","","If you like to play splashing water, this place has a wonderful and huge enough waterfall to splash you from head to toe. Green atmosphere, butterflies, dragonflies, is really nice to see. Don't even forget to see the cave of dream (gua mimpi)....","I came here with 2 friends along with 2 other guests and a tour guide, we get this ""open trip"" deal. Anyway, as we came here we didn't directly saw the so called Tanjung Bira as it was already dark, so we went to the hotel right away.  The next morning, we go on our schedule and…"
"Love the place..conserve quite well...need to consider to open few spaces for Food and beverage outlets (proper one)","Dont imagine it like beaches in Bali So much different frm it The sand...the water... So..if you wanna find blue water..white sand...watersport...bali is the best i think","","which one is Bulusaraung National Park  and which one is the waterfall ,..? why the forest ministry intermix between National Park and Waterfall and put the entrance ticket for the foreign tourist too expensive..? please seeking other waterfall price than bantimurung before the…","TANJUNG BIRA - SENGKANG  - TORAJA Tanjung bira is located in the south of Makassar the capital city of South Sulawesi Province about 5 hour drive to reach there .before arrive in tanjung bira stop at tanah beru to see the boat buliding up with traditional skill  as inheritance…"
"It's located 800 meters away from Losari. Once you got into the gate, you're gonna see the range of Dutch / colonial style. Too bad that some of the descriptions are in Indonesian. But there's a guide speaking English..or of course we can just search on the internet. Overall,…","Suasana bagus. Good atmosphere. A lot of street food. But, unfortunately the beach now getting dirty. <U+0001F623>","","Finally I could visited this place again after 30 years.  A lot of changes took place and I felt that too many man-made structure which hamper the natural beauty of the place.  Yet it is still a must visited unique place especially for those who enjoy hiking.","We always come to visite this place..... And most of our guest fell satisfied there. Just litle bit boaring on the way becouse took 5 hours maks.."
"I gone there on May-June for the MIWF or Makassar International Writer Festival. Good to see the Literature activities such as workshop, writing class, and sharing session with writers from many places.","Losari Beach is very packed. People here are taking pictures right, left and centre and you can see scores of little stores selling food and drinks around this area. You can witness some nice sunset scenery here and the beach by itself is quite dirty and filled with litters.…","","Definitely not worth it. Price for foreigners: 255 000 IDR. The price for the local IDR 25,000. Already it is devastating ripoff. Inside, dirty, virtually no butterflies. Too bad day to go there. Data from the Lonely Planet outdated, especially on prices, one big dirt and a…","oh my God, the beach was reaaaalllyyy dirty. i could found any kind of litter out there, like mineral water bottle, t-shirt, plastic bag, etc, and even weird stuff i could never thought people would throw them into the water, like used backpacker bag, and sofa. the beach was…"
"Boring to say the least. Nothing to look at. Old building left to decay with little protection from the government. The entrance guards ask for money to all tourists, despite sitting under a sign that says free entrance.","We only spent 15min here to take picture in front of ‘City of Makassar’ the leave to Somba Opu street. I saw the pic of Losari before I came here, that’s why I don’t expect much of this ‘beach’. But the real one was such a disappointment. I thought we can have a nice walking…","","this area is offering you multi-eco tourism site, for extreme sport seeker and adventurer to family adventure.","Bira beach is quite dirty to my opinion...we went there on weekdays and the place was quite,with only locals around. We didn't swim ,but just took a stroll along the beach and paid a boat to go on snorkeling trip to Liukang Loe.Bira beach could be amazing,blue water,white and…"
