Bali_dest,Yogyakarta_dest,Makassar_dest,Malang_dest,Bandung_dest
Dress and act modestly,Use polite languange,Download offline maps on your phone,Smile,Avoid extremely crowded places
Do not use your left hand to touch or give,The Bride and Groom should avoid Palbapang Intersection ,Drink bottled water,Greet people with the word Selamat,Do not go to unknown places
Do not use your index finger to point or to beckon,Do not show any PDA,Respect the local traditions and beliefs,Use the right hand,Avoid wearing excessive jewellery
Do not lose your temper,Avoid Shouting or Raising Voice in Public,Carry cash and carry small denominations,Public displays of affection are frowned upon,Do not put wallet in back pocket
Do not touch people heads,Eating with Bare Hands,Interact with the locals,A person head is considered sacred,Avoid taxi without meters
Do not enter any temple if you are menstruating,Excusing Oneself while Passing Through,Enjoy the fresh and locally sourced food,Gift giving in Indonesia depends greatly on the ethnicity of the receiver,Avoid the beggars
Keep your habit and behavior in sacred places,The Prohibition of wearing any mini pant or skirt for the woman in the temple,Prepare for squat toilets and do not forget the tissues,Do haggle when you are at the markets or at sidewalk stalls,Avoid using your phone too much
Do not interrupt any religious processions,Keep your habit and behavior in sacred places,"Avoid drugs, or anything illegal at all costs",Avoid putting your hands on your hips or crossing your arms,Avoid drinking tap water
